news_id,original_title,original_date,original_source,analysis_time,sentiment,direct_impact_score,direct_impact_desc,indirect_impact_score,indirect_impact_desc,certainty,time_to_effect,overall_score,risk_factors,action_suggestion
16,"紫金矿业港股股价盘中创新高

9月11日，紫金矿业港股价格盘中触及29.94港元，再度刷新历史纪录。Wind数据显示，截至14:13，紫金矿业港股涨0.9%，报29.26港元，折合人民币约26.76元...",2025-09-11 15:38:14,未知来源,2025-09-22 16:39:50,强烈正面,4,新闻直接报道公司股价创新高，反映市场对公司基本面的高度认可。公司2025年上半年净利润同比大增54%，盈利能力显著提升，主营产品铜、金的量价齐升直接利好公司收入和利润。,3,全球经济复苏预期和美联储降息周期推动黄金、铜等有色金属价格持续走强，利好整个有色金属行业。公司作为行业龙头，竞争优势有望进一步巩固，但需关注行业周期性波动风险。,0.9,立即,8,有色金属价格波动风险|全球经济复苏不及预期|美联储货币政策变化,强烈关注
17,"紫金矿业大宗交易成交2.88亿元

紫金矿业9月10日大宗交易平台出现一笔成交，成交量1144.20万股，成交金额2.88亿元，大宗交易成交价为25.19元，相对今日收盘价溢价0.04%。该笔交易的买...",2025-09-10 22:35:31,未知来源,2025-09-22 16:40:05,中性,0,该消息为大宗交易信息，非政策新闻。交易本身对公司基本面无直接影响，不改变公司收入、成本或利润。溢价0.04%成交且买卖双方均为机构，显示机构间对公司当前估值存在分歧但看法相对中性。,0,该交易信息不涉及公司上下游产业链、行业竞争格局或行业整体政策，无间接影响。但近3个月50笔大宗交易合计14.1亿元及融资余额近5日大幅增加26.2%，反映了市场对该股关注度较高，可能存在机构资金布局行为。,0.9,立即,0,大宗交易可能预示大股东或机构减持意图，虽本次为机构间交易|融资余额快速增加显示杠杆资金涌入，可能加剧股价短期波动|有色金属行业受大宗商品价格周期影响大，需关注金属价格走势,观望
18,"大宗交易：紫金矿业成交2.88亿元，溢价0.04%（09-10）

2025年9月10日，紫金矿业发生了1笔大宗交易，总成交1144.2万股，成交金额2.88亿元，成交价25.19元，买卖双方均为机构...",2025-09-10 17:18:03,未知来源,2025-09-22 16:40:16,中性,0,该大宗交易为市场中性行为，未直接提及公司或其主营业务。交易金额2.88亿元仅占公司3000亿市值的0.096%，且成交价与收盘价基本持平（溢价0.04%），对公司的收入、成本和利润无直接影响。,0,该交易为机构间的股份转让，不涉及公司上下游产业链或行业竞争格局的变化。其信号意义有限，仅表明有机构投资者在进行仓位调整，对有色金属行业整体无影响。,1.0,立即,0,交易本身不构成风险，但需关注后续是否有更多机构减持行为|大宗交易信息可能引发市场短期情绪波动,观望
19,"紫金矿业旗下国际控股公司增资至180亿

人民财讯9月9日电，企查查APP显示，近日，紫金国际控股有限公司发生工商变更，注册资本由120亿元增至180亿元。企查查信息显示，该公司成立于2020年，法定...",2025-09-09 14:10:01,未知来源,2025-09-22 16:40:32,中性偏正,2,政策直接提及紫金矿业旗下国际控股公司增资，表明公司加大国际业务投入，可能增强资金实力和投资能力，但对主营业务收入/成本/利润无直接影响。,3,增资可能提升公司国际资源获取和并购能力，优化上游产业链布局；增强与全球矿企的竞争力；促进行业国际化发展，但对行业整体影响有限。,0.7,3-6个月,5,增资资金使用效率不确定|国际业务面临地缘政治和汇率风险,关注
20,"紫金矿业等在池州成立新公司

南方财经9月8日电，天眼查工商信息显示，近日，池州市朱庄矿业有限公司成立，法定代表人为康旭，注册资本2000万人民币，经营范围包括矿产资源勘查、矿产资源储量评估服务、地质...",2025-09-08 14:13:02,未知来源,2025-09-22 16:40:40,中性偏正,1,政策直接提及紫金矿业，新公司成立有助于拓展上游矿产资源勘查业务，但注册资本仅2000万元，对当前3000亿市值公司收入和利润的直接影响非常有限,2,通过合资公司加强上游资源勘查能力，有利于保障长期资源供应；对产业链上游有积极影响，但短期内不会改变行业竞争格局,0.7,6个月以上,3,新公司规模较小，实际贡献有限|矿产资源勘查存在不确定性|合资公司管理协调风险,关注
59,"紫金矿业A股创收盘价历史新高

人民财讯9月5日电，2025年9月5日，紫金矿业A股股价大涨近6%，收报25.27元/股，A股市值超过5200亿元，双双创出历史新高。以A股市值排名，紫金矿业跻身第十九...",2025-09-05 15:38:47,未知来源,2025-09-22 17:55:40,强烈正面,5,新闻直接报道公司股价和市值创历史新高，显示市场对公司的高度认可，可能提升投资者信心和流动性,3,行业龙头地位巩固可能吸引更多资金流入有色金属板块，对上下游产业链产生正向拉动，但可能加剧行业竞争,0.9,立即,8,股价高位回调风险|大宗商品价格波动风险|宏观经济环境影响需求,强烈关注
60,"紫金矿业董事长陈景河与塞尔维亚总统武契奇在京会谈

据紫金矿业官微消息，9月3日下午，紫金矿业董事长陈景河与来华访问的塞尔维亚总统武契奇在北京会谈。武契奇总统表示，紫金矿业在塞尔维亚的重大投资项目有力...",2025-09-04 18:24:58,未知来源,2025-09-22 17:55:45,正面,3,政策直接提及紫金矿业在塞尔维亚的重大投资项目，塞尔维亚总统承诺提供更多政府支持和帮助，有利于公司在当地的资源勘查开发、冶炼加工等业务拓展，可能降低运营成本，提升利润空间,2,加强与塞尔维亚政府的合作有助于巩固紫金矿业在国际矿业市场的竞争地位，可能对上游资源获取和下游贸易销售产生积极影响，同时提升行业整体国际合作水平,0.7,3-6个月,5,地缘政治风险|塞尔维亚政策执行不确定性|国际金属价格波动,关注
61,"紫金矿业：副总裁于9月2日至3日累计减持25万股

南方财经9月3日电，紫金矿业(601899.SH)公告称，公司副总裁沈绍阳因筹集公司2025年员工持股计划认购资金需求原因，于2025年9月2日至3...",2025-09-03 18:41:52,未知来源,2025-09-22 17:55:51,中性偏负,-1,公告直接提及公司高管减持行为。减持规模较小（25万股，625万元），相对于3000亿市值影响微乎其微。减持原因为筹集员工持股计划资金，而非看空公司，但对市场情绪有轻微负面影响。,-1,可能引发市场对公司内部人员信心的担忧，尽管理由合理。对有色金属行业及竞争格局无直接影响。若引发其他高管效仿或市场过度解读，可能带来短期抛压。,0.8,立即,-2,市场情绪敏感期可能放大负面解读|高管减持可能影响投资者信心|若后续有更多减持可能形成趋势,观望
62,"紫金矿业：副总裁沈绍阳减持计划实施完毕

紫金矿业晚间公告，2025年9月3日，公司收到沈绍阳减持股份结果情况告知函，本次减持计划已实施完毕，沈绍阳通过集中竞价交易方式累计减持公司股份25万股。本次减...",2025-09-03 18:21:04,未知来源,2025-09-22 17:56:00,中性偏负,-1,政策直接提及公司高管减持行为，但减持数量仅25万股，占总股本比例极低（0.004%），对公司基本面（收入/成本/利润）无直接影响，但可能引发市场对高管信心的担忧,-1,高管减持可能被市场解读为内部人士对公司短期前景缺乏信心，可能影响投资者情绪，但对上下游产业链、竞争格局及行业整体无实质影响,0.9,立即,-2,市场情绪波动|可能引发其他高管跟随减持的担忧,观望
63,"金铜价格飙涨，紫金矿业、江西铜业涨2%！有色50ETF(159652)一度涨超2%，连续4日强势吸金超2亿元！全球通胀预期再起，有色金属全面开花

9月3日，A股市场回暖，上证指数微涨，创业板指涨超1...",2025-09-03 10:34:29,未知来源,2025-09-22 17:56:06,强烈正面,4,政策新闻虽未直接提及紫金矿业，但明确指出金铜价格飙涨，公司作为黄金和铜的主要生产商将直接受益于产品价格上涨。主营业务收入与利润将因价格上涨而显著提升。,4,全球通胀预期升温、美联储降息预期及去美元化趋势推动有色金属需求，行业整体向好。竞争格局中，紫金矿业作为龙头有望获得更大市场份额，但需关注原材料成本可能上升的风险。,0.8,立即,8,全球经济不确定性可能导致需求波动|美联储政策变化可能影响金属价格|原材料成本上升可能压缩利润,强烈关注
64,"紫金矿业股价又创新高，今日涨2.87%

紫金矿业股价再创历史新高，该股近期呈不断突破新高之势，近一个月累计有11个交易日股价刷新历史纪录。截至09:35，该股目前上涨2.87%，股价报25.11元，...",2025-09-03 10:10:48,未知来源,2025-09-22 17:56:14,强烈正面,4,新闻直接报道公司股价创新高，业绩表现优异：上半年营收1677.11亿元（+11.50%），净利润232.92亿元（+54.41%），显示公司主营业务增长强劲，盈利能力大幅提升,3,行业整体上涨1.30%，88只个股上涨显示行业景气度提升；融资余额近10日增加9.39亿元（+27.25%），反映市场资金持续流入；10家机构给予评级，最高目标价29元，显示分析师看好公司前景,0.9,立即,8,股价连续创新高后可能面临技术性回调|有色金属行业周期性较强，价格波动风险|宏观经济变化可能影响金属需求,强烈关注
65,"紫金矿业等入股固态电池研发商屹锂科技

企查查APP显示，近日，上海屹锂新能源科技有限公司发生工商变更，新增紫金矿业全资子公司紫金矿业投资（上海）有限公司等为股东。企查查信息显示，该公司成立于2021...",2025-09-02 17:07:47,未知来源,2025-09-22 17:56:25,中性偏正,1,政策未直接提及公司主营业务，对当前收入/成本/利润无直接影响。通过子公司入股固态电池研发商，属于财务投资，投资金额未披露，预计对当期财务影响有限。,2,通过投资新能源产业链上游的固态电池技术，可能为公司开拓新的增长点，与现有有色金属业务形成协同（如锂资源需求）。对竞争格局影响较小，因投资规模未知。对行业整体有轻微正面示范效应，显示传统矿业向新能源领域延伸的趋势。,0.6,6个月以上,3,投资金额未披露，可能仅为小额财务投资|固态电池技术商业化存在不确定性|新业务与主业协同效应需时间验证,关注
66,"紫金矿业持续走强，股价再创新高

紫金矿业股价再创历史新高，该股近期呈不断突破新高之势，近一个月累计有10个交易日股价刷新历史纪录。截至09:34，该股目前上涨1.15%，股价报24.66元，成交45...",2025-09-02 10:07:25,未知来源,2025-09-22 17:56:32,强烈正面,5,新闻直接报道公司股价创新高，融资余额大幅增长31.68%，显示市场资金强烈看好。公司半年报显示净利润同比增长54.41%，基本面表现优异，机构给予29元目标价仍有上涨空间。,4,作为行业龙头持续走强带动有色金属板块情绪，但行业内分化明显（46只上涨vs93只下跌），显示资金向头部企业集中，可能加剧行业马太效应。,0.9,立即,9,股价连续创新高后可能存在技术性回调风险|有色金属行业周期性强，宏观经济波动可能影响需求|行业内部分化明显反映行业基本面并非全面向好,强烈关注
67,"紫金矿业现3笔大宗交易 总成交金额1688.56万元

紫金矿业9月1日大宗交易平台共发生3笔成交，合计成交量69.26万股，成交金额1688.56万元。成交价格均为24.38元。 进一步统计，近3个...",2025-09-01 23:58:56,未知来源,2025-09-22 17:56:39,中性,0,该消息仅为大宗交易信息，未直接提及公司主营业务或相关政策。1688.56万元的成交金额相对于公司3000亿市值影响微乎其微（占比约0.0056%），对公司收入、成本、利润无直接影响,0,大宗交易反映了机构投资者的交易行为，但金额较小，对上下游产业链、竞争格局和有色金属行业整体均无显著影响。近3个月累计49笔大宗交易显示机构关注度较高，但本质上属于正常市场交易行为,0.9,立即,0,大宗交易可能反映大股东或机构减持意图|近5日主力资金净流出9.01亿元显示资金面压力|融资余额下降反映市场情绪偏谨慎,观望
68,"金钼股份：与紫金矿业签署合作意向书 拟合作开发安徽金寨沙坪沟钼矿

8月29日，金钼股份(601958.SH)公告称，公司与紫金矿业签署《合作意向书》，双方就合作开发安徽金寨沙坪沟钼矿达成初步意向。紫...",2025-08-29 17:21:32,未知来源,2025-09-22 17:56:47,中性偏正,2,政策直接提及紫金矿业，通过合作开发钼矿并转让部分股权，可能带来股权转让收益，并拓展钼金属业务，增加新的收入来源，但对短期利润影响有限。,3,合作有助于紫金矿业进入钼金属产业链，与金钼股份协同开发，可能提升在有色金属行业的多元化布局和竞争力，但对现有黄金、铜主业影响较小。,0.6,6个月以上,5,合作意向书为框架性约定，后续签订正式合同存在不确定性|钼矿开发周期长，短期难以贡献显著收益|金属价格波动可能影响项目盈利性,关注
69,"紫金矿业上半年净利润233亿元 黄金板块毛利贡献大幅提升超过铜

主营矿产品量价齐升之下，国内“矿茅”紫金矿业（601899.SH/2899.HK）今年上半年主要业绩指标均创历史新高。 该公司最新披露...",2025-08-28 21:15:33,未知来源,2025-09-22 17:56:56,正面,4,政策直接提及公司上半年净利润233亿元，同比增长54.41%，黄金板块毛利贡献首次超过铜，毛利率提升至60.23%。量价齐升及成本优化推动业绩创历史新高，但刚果铜矿事故可能导致矿产铜权益产量减少4.4万-9.3万吨，对全年影响有限。,3,公司通过并购（如加纳Akyem金矿）和分拆黄金资产上市，强化全球化布局，提升行业竞争力。黄金价格上涨和地缘政治动荡可能持续利好黄金业务，但资源民族主义和成本上升挑战行业整体。,0.8,立即,7,刚果铜矿事故导致产量下调|地缘政治和资源民族主义风险|成本上升和供应链挑战,关注
70,"净资产收益率全球矿业居首 紫金矿业市值首破6000亿元

最新的《财富》世界500强榜单中，紫金矿业的净资产收益率位居全球金属矿业企业第1位，源于这家公司近两年极强的盈利能力。 8月26日晚间，紫金矿...",2025-08-27 19:30:07,未知来源,2025-09-22 17:57:04,强烈正面,5,政策新闻直接提及紫金矿业，确认其净资产收益率全球矿业居首，市值突破6000亿元。公司半年报显示归母净利润增长54.41%至233亿元，黄金和铜业务量价齐升，毛利率提升，全年盈利预期上调至400亿元以上，直接利好公司收入和利润。,4,新闻凸显紫金矿业在全球矿业竞争中的领先地位，市值超越美股同行南方铜业和自由港麦克莫兰，可能增强其行业竞争力和市场份额。公司注重市值管理，包括回购、股权激励和高管承诺，间接提升投资者信心和行业整体估值水平。,0.9,立即,9,铜金价格高位震荡可能回落，影响未来盈利|非洲卡莫阿-卡库拉铜矿产量下调 due to 淹井事件|碳酸锂价格低迷导致锂业务进展放缓,强烈关注
71,"卡库拉矿段复产时间未定，碳酸锂终于放量？紫金矿业上半年盈利增速超50%

8月26日晚间，紫金矿业（601899.SH/2899.HK）披露半年报，实现归母净利润同比增长超50%。 时代周报记者注意到...",2025-08-27 18:25:39,未知来源,2025-09-22 17:57:13,中性偏正,1,政策新闻直接提及公司半年报，显示归母净利润同比增长54.41%，碳酸锂产量同比暴增2961%，但卡库拉铜矿淹井事件导致全年铜产量计划下调，权益产量减少4.4-9.3万吨。净利润增长和碳酸锂放量带来正面影响，铜产量减少带来负面影响，综合直接影响略偏正面。,2,碳酸锂业务放量（主要来自藏格矿业并表）增强了公司在新能源材料领域的布局；黄金板块分拆上市计划有望提升整体估值；铜矿事故可能短期内影响公司在铜市场的供应份额，但长期看公司资源储备和多元化策略仍具竞争力。,0.8,立即,3,卡库拉铜矿复产时间不确定，可能持续影响铜产量|碳酸锂业务建设节奏放缓，受锂价波动影响|境外资产分拆上市存在审批和市场风险,关注
72,"管理层称“采矿方法、管理整合”不足 紫金矿业最大铜矿全年预减产至少15万吨

“卡莫阿-卡库拉铜矿项目的运营，确实受到了一定影响。公司在管理运营该项目时，存在采矿方法适配性不足和管理整合问题。”8月2...",2025-08-27 17:01:12,未知来源,2025-09-22 17:57:21,负面,-3,政策新闻直接提及紫金矿业的核心铜矿项目卡莫阿-卡库拉因采矿方法和管理整合问题导致减产，全年预减产至少15万吨，直接影响公司矿产铜产量和收入。公司2025年矿产铜权益产量将相应减少4.4万吨~9.3万吨，对利润产生负面影响。,-2,减产可能导致公司市场份额下降，影响其在有色金属行业的竞争地位。同时，铜供应减少可能对下游铜加工企业产生一定影响，但鉴于国际铜价震荡上行，行业整体影响相对有限。,0.8,立即,-5,铜矿减产导致收入下降|管理运营问题可能持续影响未来产能|国际铜价波动可能加剧利润不确定性,谨慎
73,"紫金矿业上半年归母净利润232.9亿元 同比增长54.4%

8月26日，紫金矿业(601899)公布2025年半年报，公司营业收入为1677.1亿元，同比上升11.5%；归母净利润为232.9亿元，...",2025-08-27 15:53:17,未知来源,2025-09-22 17:57:28,强烈正面,5,政策新闻直接提及公司，披露了优异的2025年半年报业绩。归母净利润232.9亿元，同比大幅增长54.4%，营业收入增长11.5%，经营现金流强劲增长41.0%。矿产铜、金、银产量提升，整体矿产品毛利率增加3个百分点至60.23%，直接体现了公司盈利能力和运营效率的显著提升。,4,优异的业绩表现巩固了公司在有色金属行业的龙头地位，增强了其市场竞争力。成功的资源并购（如收购藏格矿业）和新增大量铜、锂资源储量，提升了其长期资源保障能力和增长潜力，对上游资源端控制力增强。强劲的现金流和利润为未来资本开支和扩张提供了坚实基础，可能间接促进行业整合。,1.0,立即,9,全球地缘政治动荡及资源民族主义抬头可能导致投资环境恶化|金属品位下降和成本上升的行业性挑战|境外业务分拆上市可能带来不确定性,强烈关注
74,"紫金矿业中期分红：拟每10股派发现金红利2.2元

8月26日，紫金矿业（601899/02899）发布公告，公司拟向全体股东每10股派发现金红利2.2元（含税），预计总派发金额为58.47亿元。 2...",2025-08-27 15:44:25,未知来源,2025-09-22 17:57:35,正面,3,政策直接提及公司分红方案，体现公司强劲盈利能力和现金流状况。58.47亿元分红总额占净利润的25.1%，显示公司对股东回报的重视，但会减少公司账面现金。,2,高额分红可能提升行业分红标准，增强投资者对有色金属行业信心。对上下游产业链无直接影响，但可能强化公司市场形象和融资能力。,0.95,立即,5,分红导致现金减少可能影响未来投资能力|金属价格波动可能影响持续分红能力,关注
75,"紫金矿业上半年净利润创新高 有色金属ETF基金（516650）走强

中证网讯 8月27日，稀土概念行情卷土重来。截至11:30，有色金属ETF基金（516650）涨1.38%，其持仓股北方稀土涨超7...",2025-08-27 12:09:36,未知来源,2025-09-22 17:57:42,强烈正面,4,新闻直接提及紫金矿业上半年净利润创历史新高（归母净利润233亿元，同比增长54%），业绩表现优异，直接利好公司股价和估值。,3,有色金属和黄金板块行情走强，ETF基金上涨，行业情绪积极，间接提升紫金矿业的市场关注度和板块估值水平。,0.9,立即,8,美联储降息进程不确定性可能影响黄金价格|有色金属价格波动可能影响未来业绩|宏观经济变化可能影响需求,强烈关注
76,"紫金矿业上半年归母净利润为233亿元 同比增长54%

上证报中国证券网讯（记者霍星羽）8月26日，紫金矿业发布2025年半年报，公司上半年主营矿产品量价齐升，主要业绩指标均创历史新高，实现营收167...",2025-08-27 09:38:16,未知来源,2025-09-22 17:57:50,强烈正面,5,政策直接提及紫金矿业上半年业绩大幅增长，归母净利润233亿元同比增长54.4%，营收1677亿元同比增长11.5%，矿产铜和矿产金产量分别增长9%和16%，毛利率提升至60.23%，中期分红每股0.22元总额58.5亿元，直接利好公司利润和股东回报。,4,业绩增长和项目推进（如西藏巨龙铜矿二期、卡莫阿铜冶炼厂等）增强公司在有色金属行业的竞争力，可能带动上游采矿设备和下游冶炼需求，提升行业整体估值水平，尤其是黄金板块分拆上市有望提升板块估值。,0.9,立即,9,金属价格波动可能影响未来利润|项目投产进度不及预期|全球宏观经济不确定性,强烈关注
77,"紫金矿业：上半年净利润同比增长逾五成；寒锐钴业：上半年净利润同比翻倍丨新能源早参

NO.1 紫金矿业：上半年净利润同比增长54.41% 8月26日，紫金矿业发布2025年半年度报告。公司上半年实现营...",2025-08-27 07:21:28,未知来源,2025-09-22 17:57:59,强烈正面,5,政策新闻直接提及紫金矿业，报告显示2025年上半年净利润同比增长54.41%，营业收入增长11.50%，毛利率提升4.60个百分点，主要受益于金属价格上涨和成本控制。,3,强劲的业绩可能增强公司在有色金属行业的竞争地位，提升市场份额；金属价格上涨趋势可能带动上下游产业链需求，但对竞争对手如寒锐钴业等也可能带来正面溢出效应。,0.9,立即,8,金属价格波动风险|全球经济不确定性可能影响需求|成本控制持续性挑战,强烈关注
78,"业绩再攀新高 紫金矿业拟分红超58亿元

受益于铜矿、黄金量价齐升，紫金矿业上半年主要经济指标再创新高。 紫金矿业8月26日晚披露的半年报显示，上半年实现营业收入1677.11亿元，同比增长11.5%...",2025-08-27 04:19:51,未知来源,2025-09-22 17:58:08,强烈正面,5,政策直接提及公司业绩创新高，营收1677.11亿元（同比+11.5%），归母净利润232.92亿元（同比+54.41%），分红58.5亿元彰显现金流充裕；矿产铜、金产量分别增长9%和16%，毛利率提升至60.23%。,4,通过收购藏格矿业和海外金矿（如加纳阿基姆金矿），拓展铜、锂、钾资源储量，强化产业链上游控制；分拆境外黄金板块上市可能提升估值，行业地位巩固。,0.9,立即,9,金属价格波动可能影响未来利润|海外项目运营地缘政治风险|分拆上市进程存在不确定性,强烈关注
79,"紫金矿业：上半年归母净利大增54%至233亿元，经营韧性凸显

8月26日，紫金矿业发布2025年半年报，公司上半年主营矿产品量价齐升，主要业绩指标均创历史新高，成为全球头部金属矿企效益增长最快的企业...",2025-08-26 23:38:44,未知来源,2025-09-22 17:58:18,强烈正面,5,政策直接提及公司业绩大幅增长，上半年归母净利润同比增长54%至233亿元，营收增长11.5%，毛利率提升至60.23%。矿产铜和黄金产量均实现增长，且多个重点项目即将投产，预计将进一步增厚利润。,4,公司通过收购海外金矿和藏格矿业，增强了资源储备和市场地位，分拆黄金业务上市可能提升整体估值。行业量价齐升趋势和公司成本优化能力可能带动上下游产业链协同发展，强化竞争优势。,0.9,立即,9,金属价格波动可能影响未来盈利稳定性|海外项目运营面临地缘政治和监管风险|分拆上市进程存在不确定性,强烈关注
