news_id,original_title,original_date,original_source,analysis_time,sentiment,direct_impact_score,direct_impact_desc,indirect_impact_score,indirect_impact_desc,certainty,time_to_effect,overall_score,risk_factors,action_suggestion
151,【超20家A股上市公司本周披露并购重组最新公告 紫金矿业全资子公司拟137.29亿元收购藏格矿业24.82％股份】据不完全统计，截至发稿，本周（1月13日-1月19日）包括东微半导、中能电气、亨通股份...,2025-01-19 19:15:09,未知来源,2025-09-23 23:55:26,正面,4,直接提及紫金矿业全资子公司拟137.29亿元收购藏格矿业24.82%股份，通过股权投资进入钾锂资源领域，多元化收入来源,3,布局新能源上游资源，增强产业链协同，提升在有色金属行业的综合竞争力,0.8,1-3个月,7,收购整合风险|巨额资金支出可能增加财务压力,强烈关注
150,【藏格矿业：引入紫金矿业后 有望加快释放公司在钾、锂板块的资源潜力】 就“如何看待与紫金矿业之间的协同效应？”的问题，藏格矿业1月17日在线上电话会上表示，截止目前，公司在产的察尔汗盐湖项目的氯化钾、...,2025-01-18 19:26:48,未知来源,2025-09-23 23:55:26,正面,3,间接提及与紫金矿业的协同效应，通过技术和管理输出提升藏格矿业的钾锂业务效益，间接增强紫金矿业投资收益,3,强化在锂资源板块的布局，提升新能源产业链影响力，增强多元化盈利能力,0.7,3-6个月,6,协同效应实现存在不确定性|锂价波动风险,关注
149,【紫金矿业：澳大利亚诺顿金田出售Bullabulling项目100%权益】1月17日，紫金矿业发布新闻稿称，2025年1月，诺顿金田与澳大利亚上市公司Minerals 260 Limited（下称 “...,2025-01-17 19:43:25,未知来源,2025-09-23 23:55:26,中性偏正,2,直接提及紫金矿业子公司出售澳大利亚金矿项目，获得1.565亿澳元现金和1000万澳元股票，将增加公司现金流和投资收益,1,优化海外资产结构，聚焦核心项目，但对黄金产量可能产生轻微负面影响,0.9,立即,3,项目出售可能影响未来黄金产能|澳元汇率波动风险,关注
148,【国盛证券：首予紫金矿业“买入”评级，有望持续兑现“量价齐升”逻辑】国盛证券研报指出，紫金矿业(601899.SH)作为铜金资源开发龙头叠加美联储开启降息周期叠加二次通胀预期升温，或对工业金属与贵金属...,2025-01-17 14:52:30,未知来源,2025-09-23 23:53:38,强烈正面,4,与新闻3内容完全一致，券商'买入'评级直接提升投资价值；公司资源储备和产量增长预期直接利好财务表现,3,行业龙头地位巩固，对上下游议价能力增强；绿色转型和新材料布局符合长期发展趋势,0.75,1-3个月,7,宏观经济环境变化可能影响金属需求|新项目投产进度可能存在延迟风险,强烈关注
147,【国盛证券：首予紫金矿业“买入”评级，有望持续兑现“量价齐升”逻辑】国盛证券研报指出，紫金矿业(601899.SH)作为铜金资源开发龙头叠加美联储开启降息周期叠加二次通胀预期升温，或对工业金属与贵金属...,2025-01-17 14:52:21,未知来源,2025-09-23 23:53:38,强烈正面,4,券商首次覆盖给予'买入'评级，直接提升市场信心和投资吸引力；'量价齐升'逻辑直接利好公司收入和利润增长,3,研报强调美联储降息周期和二次通胀预期，间接利好整个有色金属行业；公司全球领先地位凸显，增强行业竞争力,0.75,1-3个月,7,美联储政策实际执行可能存在变数|金属价格波动可能影响'量价齐升'逻辑兑现,强烈关注
146,【紫金矿业：拟以137.29亿元收购藏格矿业24.82%股份】紫金矿业公告，公司全资子公司紫金国际控股于2025年1月16日与藏格创投、四川永鸿、林吉芳、新沙鸿运签署《关于藏格矿业股份有限公司的控制权...,2025-01-16 21:47:25,未知来源,2025-09-23 23:53:38,正面,3,公司拟137.29亿元收购藏格矿业24.82%股份并获得控制权，将直接增加公司资源储备和未来产量，通过财务并表提升营收规模,2,收购增强公司在锂等能源金属领域的布局，完善产品结构；可能改变有色金属行业竞争格局，提升行业集中度,0.8,3-6个月,5,大规模收购带来资金压力和整合风险|藏格矿业经营状况和资源质量存在不确定性,强烈关注
145,【春季躁动行情渐行渐近，A50ETF华宝（159596）昨日“吸金”1927万】1月16日，市场全天冲高回落，A50ETF华宝（159596）收涨0.19%，成交额1.67亿元。成份股方面，十大重仓股...,2025-01-16 18:09:58,未知来源,2025-09-23 23:53:38,中性偏正,1,新闻直接提及紫金矿业在A50ETF成份股中领涨，显示市场资金关注度提升，可能带来短期股价正面表现,2,春季躁动行情预期和资金净流入A50ETF，间接反映市场风险偏好提升，有利于有色金属板块整体表现,0.7,立即,3,市场整体冲高回落，行情持续性存疑|春季躁动行情仅为预期，实际兑现存在不确定性,关注
144,【春季躁动行情渐行渐近，A50ETF华宝（159596）昨日“吸金”1927万】1月16日，市场全天冲高回落，A50ETF华宝（159596）收涨0.19%，成交额1.67亿元。成份股方面，十大重仓股...,2025-01-16 18:09:52,未知来源,2025-09-23 23:52:22,正面,3,紫金矿业在A50ETF中领涨，作为十大重仓股直接受益于ETF资金流入,2,春季躁动行情预期提升市场风险偏好，有色金属板块可能获得资金青睐,0.5,1-3个月,5,市场行情波动|宏观经济变化影响,关注
143,【机构聚焦光伏设备、游戏及有色金属行业投资机会，可借道沪深300ETF南方（159925）一键布局】1月16日，沪深300ETF南方（159925）收平，成交额9089.32万元。成份股涨跌互现，上涨...,2025-01-16 18:07:20,未知来源,2025-09-23 23:52:22,中性偏正,2,机构推荐有色金属行业，紫金矿业作为成份股领涨，直接受益于行业关注度提升,2,行业整体被看好，可能带动资金流入和估值提升，增强市场对有色金属板块的信心,0.6,1个月内,4,行业周期波动|政策效果不及预期,关注
142,【紫金矿业：公司及在疆部分权属企业被列入UFLPA实体清单】紫金矿业公告，美国国土安全部将公司及新疆紫金有色金属有限公司、新疆哈巴河阿舍勒铜业股份有限公司、新疆金宝矿业有限责任公司、新疆紫金锌业有限公...,2025-01-15 21:34:21,未知来源,2025-09-23 23:52:22,中性偏负,-1,被列入UFLPA实体清单，但公司在美国无业务且新疆业务占比不足5%，直接影响有限,-3,可能影响国际形象和ESG评级，潜在的国际客户和投资者关系受损,0.7,1-3个月,-4,地缘政治风险升级|国际业务拓展受阻|ESG评级下调风险,观望
141,【南向资金今日净买入93.5亿港元，腾讯控股获净买入19.08亿港元】南向资金今日净买入93.5亿港元。腾讯控股、中芯国际、紫金矿业分别获净买入19.08亿港元、10.17亿港元、7.48亿港元；美团...,2025-01-15 17:38:09,未知来源,2025-09-23 23:52:22,正面,3,南向资金净买入7.48亿港元紫金矿业，直接带来资金流入和股价支撑,2,大额南向资金流入显示国际投资者对公司的信心，可能带动其他资金跟风买入,0.8,立即,5,资金流向可能短期变化|市场情绪波动影响,关注
140,【新质科技方向或领涨“春季躁动”行情，关注沪深300ETF南方（159925）布局机会】1月15日，沪深300ETF南方（159925）收盘跌0.65%，成交额3619.04万元。成份股涨跌互现，上涨...,2025-01-15 16:33:19,未知来源,2025-09-23 23:49:57,中性偏负,-1,新闻提及紫金矿业作为沪深300ETF成份股领跌，短期可能面临市场抛压，但未直接涉及公司基本面，对收入/成本/利润无直接影响,-2,新闻强调新质科技方向（如低空经济、AI）可能领涨春季行情，而传统有色金属行业非焦点，可能分流资金，间接压制行业估值,0.5,立即,-3,市场风格切换至科技板块，有色金属板块短期承压|行情判断基于预期，实际走势可能偏离,观望
139,【紫金矿业新能源新材料科技公司增资至2亿 增幅300%】天眼查App显示，近日，紫金矿业新能源新材料科技（长沙）有限公司发生工商变更，注册资本由5000万人民币增至2亿人民币，增幅300%。该公司成立...,2025-01-15 16:04:18,未知来源,2025-09-23 23:49:57,正面,2,紫金矿业全资子公司增资至2亿元，增幅300%，直接加大对新能源新材料业务的投入，可能拓展新收入来源（如电池制造、金属材料销售），但短期对主营业务（黄金、铜）影响较小,3,进军新能源新材料领域可能增强公司长期竞争力，顺应科技和环保趋势，但对当前有色金属行业格局无直接影响,0.9,3-6个月,5,新能源业务处于早期阶段，盈利时间不确定|新领域竞争激烈，存在市场风险,关注
138,【藏格矿业：新沙鸿运投资拟上调转让比例 股票继续停牌】 藏格矿业(000408)1月13日晚间公告，此前公告，公司控股股东藏格创投及其一致行动人，以及第二大股东新沙鸿运投资正在筹划股份转让事宜。截至本...,2025-01-13 19:55:34,未知来源,2025-09-23 23:49:57,正面,3,紫金矿业拟通过股权转让增持藏格矿业股份至25%以上，可能增强对藏格矿业的控制力，拓展资源储备，潜在提升未来收入和利润,2,增持同行企业股份可能优化行业竞争格局，加强紫金矿业在有色金属领域的市场地位，但对上下游产业链影响有限,0.8,1-3个月,5,股权转让尚未完成，存在交易失败风险|整合藏格矿业可能带来管理挑战,关注
137,【积极布局下一轮进攻行情，A50ETF华宝（159596）迎布局窗口期】1月13日，市场全天震荡分化，A50ETF华宝（159596）收跌0.38%，成交额1.25亿元。成份股方面，十大重仓股涨多跌少...,2025-01-13 17:15:59,未知来源,2025-09-23 23:49:57,中性偏正,1,新闻直接提及紫金矿业作为A50ETF华宝十大重仓股中领涨的成份股，显示其在ETF中的表现突出，可能吸引更多资金关注,2,新闻提到市场调整后有望迎来新一轮进攻行情，政策预期（如降准降息、流动性改善等）可能提振整体市场情绪，间接利好有色金属行业,0.6,1个月内,3,市场行情依赖政策落地，存在不确定性|ETF成份股涨跌受多重因素影响，持续性存疑,关注
136,【积极布局下一轮进攻行情，A50ETF华宝（159596）迎布局窗口期】1月13日，市场全天震荡分化，A50ETF华宝（159596）收跌0.38%，成交额1.25亿元。成份股方面，十大重仓股涨多跌少...,2025-01-13 17:15:54,未知来源,2025-09-23 23:47:49,中性偏正,1,新闻未直接提及紫金矿业的具体业务，但提到紫金矿业在A50ETF中领涨，显示其短期市场表现较强。,2,新闻提到新一轮进攻行情的预期，以及政策催化因素，间接利好大盘股和资源类股票如紫金矿业。,0.6,1-3个月,3,宏观经济波动可能影响市场整体表现|汇率和政策变化不确定性,关注
135,【春节前或以结构性行情为主，可借道沪深300ETF南方（159925）一键布局A股核心资产】1月13日，沪深300ETF南方（159925）收盘跌0.40%，成交额4975.39万元。成份股涨跌互现，...,2025-01-13 16:59:57,未知来源,2025-09-23 23:47:49,中性偏正,1,新闻未直接提及紫金矿业的具体业务，但提到紫金矿业在沪深300ETF中领涨，显示其短期市场表现较强。,1,新闻提到春节后市场可能迎来上涨，间接利好大盘股如紫金矿业，但未具体提及有色金属行业。,0.5,1个月内,2,市场情绪波动可能影响短期表现|行业政策变化不确定性,观望
134,【短期市场或延续震荡休整格局，可借道沪深300ETF南方（159925）把握新一轮反弹行情】1月10日，沪深300ETF南方（159925）收盘跌1.16%，成交额7687.11万元。成份股涨跌互现，...,2025-01-10 16:10:10,未知来源,2025-09-23 23:47:49,中性偏正,1,新闻未直接提及紫金矿业的具体业务，但提到紫金矿业在沪深300ETF中领涨，显示市场对其短期表现的认可。,2,新闻建议关注稀土有色等板块，间接利好有色金属行业，可能提升投资者对紫金矿业的关注度。,0.6,立即,3,市场整体震荡，可能存在系统性风险|行业景气度波动可能影响股价,关注
133,【藏格矿业：控股股东拟转让24.72%股份 股票停牌】 藏格矿业公告，公司控股股东藏格创投及其一致行动人和第二大股东新沙鸿运投资正在筹划股份转让事宜，预计转让股份占公司总股本的24.72%。其中，藏格...,2025-01-09 20:54:00,未知来源,2025-09-23 23:47:49,强烈正面,5,紫金矿业拟收购藏格矿业24.72%股份，这将直接增强紫金矿业对上游锂资源的控制力，扩大资源储备，提升公司在新能源金属领域的竞争力。,4,收购将优化紫金矿业在有色金属行业的战略布局，可能改变行业竞争格局，提升公司在锂等新能源金属市场的话语权。,0.8,1-3个月,9,交易尚未最终完成，存在不确定性|收购后整合可能面临管理挑战,强烈关注
132,港交所：1月3日，摩根大通在紫金矿业H股的空头头寸从1.73%增至2.32%。...,2025-01-09 17:24:24,未知来源,2025-09-23 23:45:35,中性偏负,-2,摩根大通增加空头头寸可能增加股价短期卖压，反映机构对股价的谨慎看法,-1,可能影响市场情绪和投资者信心，引发其他投资者跟风抛售,0.8,立即,-3,空头头寸增加可能加剧股价波动|市场情绪转负风险,谨慎
131,【龙净环保：控股股东紫金矿业累计增持1.25%公司股份】 龙净环保(600388)1月8日晚间公告，自2024年11月26日至2025年1月8日期间，公司控股股东紫金矿业集团股份有限公司（简称“紫金矿...,2025-01-08 19:19:52,未知来源,2025-09-23 23:45:35,中性偏正,1,与新闻2内容重复，增持龙净环保股份不直接影响紫金矿业主营业务，但显示控股股东信心,1,增强子公司控制力，有利于业务协同，但对有色金属主业影响较小,0.9,立即,2,信息重复，市场影响已消化|增持效果有限,观望
130,【龙净环保：控股股东紫金矿业累计增持公司1.25%股份】龙净环保公告，公司控股股东紫金矿业通过二级市场集中竞价方式自2024年11月26日至2025年1月8日期间，累计增持公司股份1584万股，占公司...,2025-01-08 18:52:38,未知来源,2025-09-23 23:45:35,中性偏正,1,增持龙净环保股份不直接影响紫金矿业主营业务收入成本，但显示控股股东对子公司发展的信心,1,增强对子公司的控制力，有利于业务协同，但对有色金属主业影响有限,0.9,立即,2,增持资金使用可能影响现金流|环保业务与主业协同效果待观察,观望
129,【紫金矿业刚果（金）首个锂矿项目预计将于2026年第一季度投产】紫金矿业发言人通过电子邮件表示，该公司在刚果（金）开发的首个锂矿勘探项目——马诺诺（Manono）项目预计将于2026年第一季度投产。刚...,2025-01-07 21:14:05,未知来源,2025-09-23 23:45:35,正面,3,项目直接涉及公司主营业务扩张，锂矿项目投产将增加新的收入来源，预计对公司未来收入和利润产生积极影响,2,进入锂矿领域有助于公司多元化布局，顺应新能源发展趋势，但面临新领域的竞争和技术挑战,0.7,6个月以上,5,项目投产时间较长，存在不确定性|锂矿市场价格波动风险|刚果（金）地缘政治风险,关注
127,【节前可更多关注大盘蓝筹方向，A50ETF华宝（159596）或迎逢低布局机会】1月7日，指数午后集体反弹，A50ETF华宝（159596）收涨0.19%，成交额1.73亿元。成份股方面，十大重仓股涨...,2025-01-07 15:17:47,未知来源,2025-09-23 23:42:19,中性偏正,0,政策新闻未直接提及紫金矿业或其主营业务，也未出台直接影响公司收入、成本或利润的具体政策。新闻仅提及该股在ETF成份股中领涨，属于市场交易行为层面的描述。,2,新闻传递了机构（财通证券）看好节前大盘蓝筹方向的观点。紫金矿业作为有色金属行业龙头，符合大盘蓝筹特征，可能间接受益于市场资金向该风格切换带来的流动性偏好提升。对行业整体和竞争格局无直接影响。,0.6,1个月内,2,市场风格切换的持续性和力度存在不确定性|新闻来源为未知来源，权威性不足|节前市场情绪波动可能较大,关注
126,【紫金矿业旗下海外发展公司增资至28.3亿 增幅241%】天眼查App显示，近日，紫金海外发展（海南）有限公司发生工商变更，注册资本由8.3亿人民币增至28.3亿人民币，增幅约241%。紫金海外发展（...,2025-01-06 14:03:34,未知来源,2025-09-23 23:40:48,正面,2,政策直接提及紫金矿业旗下海外发展公司，大幅增资241%至28.3亿元，表明公司加大对海外业务的资本投入，有助于提升海外资源获取、进出口贸易和国际运输代理能力，可能直接推动海外业务收入和利润增长。,3,增资强化公司海外布局，可能增强对上游矿产资源控制力，降低采购成本；提升国际市场份额，加剧行业竞争；推动有色金属行业国际化发展，但对下游客户影响较小。,0.8,3-6个月,5,海外运营面临地缘政治、汇率波动等风险|增资效果需时间验证，短期可能稀释ROE,关注
125,【华福证券增资至44.9亿元，紫金矿业等入股】天眼查App显示，2024年12月26日，华福证券有限责任公司发生工商变更，新增紫金矿业旗下紫金矿业集团资本投资有限公司以及东方创业（600278）、兰生...,2025-01-03 17:49:33,未知来源,2025-09-23 23:40:12,中性偏正,1,政策未直接提及紫金矿业主营业务。通过旗下资本投资公司入股华福证券，属于财务投资行为，对主营业务收入/成本/利润无直接影响。但增资行为本身显示了公司的资金实力和多元化布局的意愿。,2,入股券商有助于公司拓展金融投资渠道，可能优化资金使用效率并获得财务投资收益。对上下游产业链和行业竞争格局无直接影响。此举反映了大型矿业集团向金融领域渗透的趋势，但对有色金属行业整体影响甚微。,0.9,1个月内,3,金融投资回报具有不确定性，可能面临证券市场波动风险|资金用于投资券商可能导致主业资本开支相对减少|跨行业经营存在管理整合风险,关注
124,【紫金矿业等入股华福证券 后者增资至44.9亿】天眼查App显示，近日，华福证券有限责任公司发生工商变更，新增紫金矿业旗下紫金矿业集团资本投资有限公司以及东方创业（600278）、兰生股份（60082...,2025-01-03 17:06:55,未知来源,2025-09-23 23:37:18,中性偏正,1,紫金矿业通过旗下投资公司入股华福证券，属于财务投资行为，对主营业务无直接影响,2,拓展金融投资业务有助于多元化收入来源，提升资金运用效率，但短期内对业绩贡献有限,0.8,3-6个月,3,金融业务与主业协同性有限|证券行业竞争激烈，投资回报存在不确定性,观望
123,【大盘风格相对优势有望回归，A50ETF华宝（159596）迎布局窗口期】1月3日，市场全天震荡走低延续跌势，A50ETF华宝（159596）跌1.11%，成交额1.41亿元。成份股方面，十大重仓股涨...,2025-01-03 15:14:24,未知来源,2025-09-23 23:37:18,正面,2,与新闻2内容相同，紫金矿业作为A50ETF成份股领涨，显示其在大盘股中的相对强势表现,3,大盘风格优势回归的预期继续支撑紫金矿业的相对表现，有利于吸引机构资金配置,0.7,立即,5,市场情绪可能快速变化|ETF资金流动具有不确定性,关注
122,【大盘风格相对优势有望回归，A50ETF华宝（159596）迎布局窗口期】1月3日，市场全天震荡走低延续跌势，A50ETF华宝（159596）跌1.11%，成交额1.41亿元。成份股方面，十大重仓股涨...,2025-01-03 15:14:18,未知来源,2025-09-23 23:37:18,正面,2,新闻显示紫金矿业在A50ETF成份股中领涨，反映市场对其大盘股属性的认可，可能带来资金流入,3,大盘风格回归预期有利于紫金矿业这类大盘蓝筹股的估值提升，增强市场信心,0.7,立即,5,市场风格变化存在不确定性|整体市场走势仍受宏观经济影响,关注
121,【国泰君安：维持龙净环保“增持”评级，目标价16.65元】国泰君安研报指出，龙净环保(600388.SH)收购湖南创远15.87%股权，进一步完善公司在新能源矿山装备业务的产业布局，维持目标价16.6...,2025-01-03 15:02:52,未知来源,2025-09-23 23:37:18,中性偏正,1,新闻主要关于龙净环保收购事项，紫金矿业作为控股股东间接参与，但对紫金矿业主营业务无直接影响,2,通过控股股东关系，紫金矿业可能受益于新能源矿山装备产业链的完善，储能业务发展可能带来长期协同效应,0.6,6个月以上,3,交易规模较小，影响有限|新能源业务处于发展初期，盈利能力有待验证,观望
120,【国泰君安：维持龙净环保“增持”评级，目标价16.65元】国泰君安研报指出，龙净环保(600388.SH)收购湖南创远15.87%股权，进一步完善公司在新能源矿山装备业务的产业布局，维持目标价16.6...,2025-01-03 15:02:35,未知来源,2025-09-23 23:36:22,正面,2,新闻涉及紫金矿业控股的龙净环保收购新能源矿山装备公司股权，完善产业布局，间接反映紫金矿业在新能源领域的战略延伸,3,通过控股公司布局新能源矿山装备和储能业务，有助于紫金矿业延伸产业链，提升在绿色矿业领域的竞争力，符合行业转型趋势,0.7,3-6个月,5,新能源业务处于早期阶段|收购整合效果待观察|投资回报周期较长,关注
119,【“春季躁动”正当时，A50ETF华宝（159596）迎布局窗口期】1月2日，市场全天单边下行，A50ETF华宝（159596）跌2.71%，成交额1.68亿元。成份股方面，十大重仓股涨跌互现。上涨方...,2025-01-02 18:00:44,未知来源,2025-09-23 23:36:22,中性偏正,1,新闻重复提及紫金矿业在A50ETF成份股中领涨，显示其市场表现强劲，但内容与新闻2完全相同，无新增信息,2,与新闻2相同，春季躁动行情和积极政策预期有利于提升市场整体情绪，间接利好有色金属等周期性行业,0.5,1个月内,3,信息重复无增量|市场环境不确定性|行情持续性存疑,观望
118,【“春季躁动”正当时，A50ETF华宝（159596）迎布局窗口期】1月2日，市场全天单边下行，A50ETF华宝（159596）跌2.71%，成交额1.68亿元。成份股方面，十大重仓股涨跌互现。上涨方...,2025-01-02 18:00:39,未知来源,2025-09-23 23:36:22,中性偏正,1,新闻提及紫金矿业在A50ETF成份股中领涨，显示其作为权重股表现突出，但未涉及具体政策或业务影响,2,春季躁动行情和流动性宽松环境有利于市场风险偏好提升，作为周期性有色金属龙头，紫金矿业可能受益于经济预期改善和资金流入,0.5,1个月内,3,市场单边下行趋势|春季行情不及预期|流动性环境变化,关注
117,【政策增量叠加经济快速回暖，机构称上半年看好核心资产，可借道沪深300ETF南方（159925）一键布局】1月2日，截止午盘，沪深300ETF南方（159925）跌1.47%，成交额5613.46万元...,2025-01-02 11:48:56,未知来源,2025-09-23 23:36:22,中性偏正,1,新闻直接提及紫金矿业在沪深300ETF中领涨，显示其作为核心资产受到市场关注，但未直接提及公司具体业务或政策,2,政策增量和经济回暖预期有利于大盘风格回归，作为有色金属行业龙头，紫金矿业可能受益于整体市场情绪改善和资金流入大盘股,0.6,1个月内,3,市场整体下跌拖累个股表现|经济回暖不及预期|大盘风格回归持续性不确定,关注
116,【1 月或进入“春季躁动”加速阶段，A50ETF华宝（159596）半日成交额破亿】1月2日，A股市场迎来2025年首个交易日，市场早盘震荡下挫，截止午盘，A50ETF华宝（159596）跌1.44%...,2025-01-02 11:44:47,未知来源,2025-09-23 23:34:12,中性偏正,1,与新闻3内容重复，提及紫金矿业在A50ETF成份股中领涨，但未涉及公司具体业务变化,2,市场春季躁动行情可能带来资金流入，间接推动大型成份股表现,0.5,1个月内,3,市场波动风险|宏观经济不确定性,观望
115,【1 月或进入“春季躁动”加速阶段，A50ETF华宝（159596）半日成交额破亿】1月2日，A股市场迎来2025年首个交易日，市场早盘震荡下挫，截止午盘，A50ETF华宝（159596）跌1.44%...,2025-01-02 11:44:40,未知来源,2025-09-23 23:34:12,中性偏正,1,新闻提及A50ETF成份股中紫金矿业领涨，但未直接涉及公司基本面变化，属于市场整体表现,2,春季躁动行情和市场增量资金可能带动整体市场情绪，间接利好大盘股如紫金矿业,0.5,1个月内,3,市场行情不确定性|宏观政策变化风险,观望
