news_id,original_title,original_date,original_source,analysis_time,sentiment,direct_impact_score,direct_impact_desc,indirect_impact_score,indirect_impact_desc,certainty,time_to_effect,overall_score,risk_factors,action_suggestion
226,【黄金概念股午后拉升，多只黄金股ETF大涨超4%】 黄金概念股午后拉升，晓程科技涨超10%，西部黄金、紫金矿业、赤峰黄金等涨超5%，多只黄金股ETF大涨超4%，截至发稿，华夏中证沪深港黄金产业股票ET...,2025-05-21 14:37:35,未知来源,2025-09-24 00:33:57,强烈正面,4,新闻直接提及紫金矿业作为黄金概念股涨超5%，显示公司作为黄金龙头受益于黄金价格上涨行情,3,黄金ETF大涨显示机构资金看好黄金产业，有利于提升整个黄金板块的估值水平；黄金价格上涨将带动公司产品溢价,0.8,立即,7,黄金价格波动风险|市场情绪变化,强烈关注
225,【主力资金监控：国防军工板块净流入超44亿元】数据显示，今日主力资金净流入国防军工、机械设备、非银金融等板块，净流出农林牧渔、半导体、计算机等板块，其中国防军工板块净流入超44亿元。个股方面，中航成飞...,2025-05-12 14:20:36,未知来源,2025-09-24 00:33:57,中性偏负,-1,新闻直接提及紫金矿业出现在主力资金净流出名单中，显示当日有资金流出该股，可能对短期股价形成压力,-2,资金流向国防军工等板块，分流了有色金属板块资金；市场资金偏好转向可能影响整个有色金属板块的估值水平,0.7,立即,-3,资金流出压力|板块轮动风险|市场情绪变化,观望
224,紫金矿业据悉选择中信证券和摩根士丹利为其安排黄金业务香港IPO事宜。...,2025-05-12 13:06:01,未知来源,2025-09-24 00:32:35,中性偏正,2,与新闻3内容重复，分拆黄金业务赴港IPO可能带来融资收益，但对现有业务短期财务影响有限,3,选择知名投行安排IPO显示公司重视程度，有助于提升国际市场形象，但对行业整体影响中性,0.7,6个月以上,5,IPO进程存在不确定性|港股市场波动可能影响发行效果,观望
223,紫金矿业据悉选择中信证券和摩根士丹利为其安排黄金业务香港IPO事宜。...,2025-05-12 13:05:53,未知来源,2025-09-24 00:32:35,中性偏正,2,分拆黄金业务赴港IPO可能为公司带来一次性融资收益，但短期内对现有业务收入和利润无直接影响,3,IPO有助于提升黄金业务估值，增强公司资本运作能力，可能为后续发展提供资金支持，但对行业竞争格局影响较小,0.7,6个月以上,5,IPO审批存在不确定性|市场环境可能影响发行估值,观望
222,【紫金矿业：完成藏格矿业控制权收购】紫金矿业公告，公司全资子公司紫金国际控股于2025年4月30日完成对藏格矿业股份有限公司的控制权收购，合计持有藏格矿业4.11亿股股份，占其总股本26.18%。藏格...,2025-05-06 17:32:12,未知来源,2025-09-24 00:32:35,正面,3,完成对藏格矿业控制权收购，新增钾资源储备，将直接增加公司资源储量，拓展钾盐业务，预计未来可带来新的收入增长点,2,收购有助于整合优质资源，提升巨龙铜矿运营效率，增强公司在有色金属行业的综合竞争力，但对行业整体格局影响有限,0.9,3-6个月,5,整合效果不及预期|钾盐市场价格波动风险,关注
221,【这些股票 QFII大笔加仓 QFII对宁波银行持仓超320亿元】Wind数据显示，截至4月30日，5399家上市公司披露了2025年一季报，其中692家公司的前十大流通股东中出现了QFII的身影；一...,2025-05-01 13:08:31,未知来源,2025-09-24 00:32:35,中性偏正,1,新闻显示QFII对紫金矿业持仓市值超28亿元，表明外资机构对公司有一定认可度，可能带来增量资金流入，但对公司基本面无直接影响,2,QFII大额持仓提升了公司在国际投资者中的知名度，可能改善流动性，增强市场信心，但对行业竞争格局无实质性影响,0.8,立即,3,QFII持仓变动具有不确定性|市场情绪变化可能影响资金流向,关注
220,【紫金矿业：拟分拆紫金黄金国际至香港联交所主板上市】 紫金矿业公告，为加快黄金板块国际化进程，公司拟将下属境外黄金矿山资产重组至紫金黄金国际，并申请分拆至香港联交所主板上市。本次分拆上市有利于黄金资产...,2025-04-30 19:56:15,未知来源,2025-09-24 00:31:44,正面,4,重复确认分拆计划，强化了公司推进黄金业务国际化的战略决心，有利于黄金资产价值释放,3,再次公告分拆计划增强了市场对公司战略执行的信心，可能提升行业地位和品牌价值,0.6,6个月以上,7,监管审批风险|国际市场价格波动|分拆进程延迟,关注
219,【紫金矿业：拟分拆紫金黄金国际至香港联交所主板上市】 紫金矿业公告，为加快黄金板块国际化进程，公司拟将下属境外黄金矿山资产重组至紫金黄金国际，并申请分拆至香港联交所主板上市。本次分拆上市有利于黄金资产...,2025-04-30 19:54:49,未知来源,2025-09-24 00:31:44,正面,4,分拆黄金资产上市有利于资产价值重估，可能通过股权融资获得资金支持黄金业务发展，提升公司整体估值,3,分拆上市有助于提升公司在国际黄金市场的知名度和竞争力，可能吸引更多国际投资者关注,0.6,6个月以上,7,审批不确定性|市场环境变化|分拆执行风险,关注
218,【南向资金今日大幅净买入213.6亿港元 盈富基金获买入额居前】南向资金今日大幅净买入213.6亿港元。港股通（沪）方面，盈富基金、恒生中国企业分别获净买入46.17亿港元、39.37亿港元；小米集团...,2025-04-22 17:39:44,未知来源,2025-09-24 00:31:44,负面,-3,新闻再次确认紫金矿业在南向资金中被净卖出7.27亿港元，重复的资金流出信号强化了短期负面压力,-2,重复的资金流出信息可能进一步削弱投资者信心，加剧短期股价波动,0.9,立即,-5,连续资金流出|投资者信心受损|股价波动加剧,谨慎
217,【南向资金今日大幅净买入213.6亿港元 盈富基金获买入额居前】南向资金今日大幅净买入213.6亿港元。港股通（沪）方面，盈富基金、恒生中国企业分别获净买入46.17亿港元、39.37亿港元；小米集团...,2025-04-22 17:39:28,未知来源,2025-09-24 00:31:44,负面,-3,新闻直接提及紫金矿业在南向资金中被净卖出7.27亿港元，表明短期内资金流出压力，可能对股价形成直接压制,-2,南向资金大幅净买入但紫金矿业被卖出，可能反映机构投资者对该股的短期谨慎态度，影响市场情绪和投资者信心,0.9,立即,-5,资金流出压力|市场情绪转弱|短期抛售风险,谨慎
216,【最新QFII持仓曝光，中东主权财富基金现身】 据Wind统计，截至4月19日，A股已有246家上市公司公布2025年一季报，其中，33只个股前十大流通股东中出现QFII身影，且大部分为一季度新晋。作...,2025-04-20 22:43:55,未知来源,2025-09-24 00:29:48,中性偏正,1,QFII持仓曝光显示国际机构投资者持续关注，但无直接业务或财务影响,2,国际主权财富基金的持续持仓有助于提升公司在国际资本市场的形象和吸引力，可能带来长期资金支持,0.7,立即,3,国际资本流动风险|汇率波动风险,观望
215,【最新QFII持仓曝光，中东主权财富基金现身】 据Wind统计，截至4月19日，A股已有246家上市公司公布2025年一季报，其中，33只个股前十大流通股东中出现QFII身影，且大部分为一季度新晋。作...,2025-04-20 22:43:46,未知来源,2025-09-24 00:29:48,中性偏正,1,QFII持仓信息显示国际投资者对公司保持关注，但无直接财务影响,2,中东主权财富基金持续持仓表明对公司长期价值的认可，有助于提升市场信心和投资者关注度,0.7,立即,3,信息披露滞后风险|外资投资偏好变化风险,观望
214,【中东主权基金A股布局显现 加仓东方锆业、紫金矿业等】随着上市公司一季报逐渐披露，中东富豪们的对A股布局也浮出水面。其中，中东主权财富基金阿布达比投资局（ADIA）最新持仓数据显示，其以1.63亿股的...,2025-04-18 16:06:45,未知来源,2025-09-24 00:29:48,正面,2,中东主权基金阿布达比投资局以1.63亿股重返前十大流通股东，显示国际机构对公司投资价值的认可，可能带来增量资金,3,中东主权基金的加仓行为可能引发其他国际投资者关注，提升公司国际知名度和市场信心，改善股东结构,0.8,立即,5,外资持股变动风险|市场情绪变化风险,关注
213,【紫金矿业：加纳Akyem金矿项目完成交割】紫金矿业公告，公司通过境外全资子公司收购Newmont Corporation旗下加纳Akyem金矿100%权益的收购已于北京时间2025年4月16日完成交...,2025-04-16 18:49:56,未知来源,2025-09-24 00:29:48,强烈正面,4,直接收购加纳Akyem金矿100%权益，增加黄金产量和收入。该矿2023年实现销售收入5.74亿美元，净利润1.28亿美元，将直接提升公司营收和利润水平,3,增强公司在全球黄金开采领域的资源储备和产能规模，提升国际竞争力。收购成熟运营矿山可快速产生效益，巩固公司在有色金属行业的龙头地位,0.9,立即,7,海外运营风险|金价波动风险|当地政策环境变化风险,强烈关注
212,【紫金矿业：加纳Akyem金矿项目完成交割】紫金矿业公告，公司通过境外全资子公司收购Newmont Corporation旗下加纳Akyem金矿100%权益的收购已于北京时间2025年4月16日完成交...,2025-04-16 18:49:49,未知来源,2025-09-24 00:27:12,正面,3,公司完成收购加纳Akyem金矿100%权益，该矿2023年净利润1.28亿美元，将直接增加公司黄金产量和利润来源，扩大资源储备,2,海外优质金矿资产的收购增强公司在全球黄金行业的布局和话语权，可能引发同业跟进海外并购，影响行业竞争格局,1.0,1-3个月,5,海外运营政治风险|金矿开采成本控制挑战|汇率波动影响,关注
211,【第一上海：紫金矿业业绩再创历史新高，维持“买入”评级】第一上海研报指出，紫金矿业(2899.HK)一季度归母净利润102亿元，同环比分别增加62.4%/32.2%。一季度铜金量价齐升，带动公司业绩再...,2025-04-16 15:28:52,未知来源,2025-09-24 00:27:12,强烈正面,4,与新闻2内容完全一致，券商研报确认业绩创新高并上调盈利预测和目标价，重申买入评级，对公司估值有直接正面影响,3,重复的积极研报信息强化市场信心，可能引发更广泛的市场关注和投资者跟进行为，巩固行业龙头地位,0.9,立即,7,研报预测过于乐观风险|金属价格周期性波动风险,强烈关注
210,【第一上海：紫金矿业业绩再创历史新高，维持“买入”评级】第一上海研报指出，紫金矿业(2899.HK)一季度归母净利润102亿元，同环比分别增加62.4%/32.2%。一季度铜金量价齐升，带动公司业绩再...,2025-04-16 15:25:13,未知来源,2025-09-24 00:27:12,强烈正面,4,券商研报确认公司一季度归母净利润102亿元，同环比大幅增长62.4%/32.2%，业绩创历史新高，并上调未来三年盈利预测和目标价，直接影响公司估值预期,3,研报维持买入评级并上调目标价，可能增强市场信心，吸引更多机构投资者关注，提升公司在有色金属行业的龙头地位认可度,0.9,立即,7,大宗商品价格回调风险|宏观经济环境变化影响需求,强烈关注
209,【紫金矿业董秘郑友诚：黄金和铜为公司带来的回报正不断缩小】“过去大家关注紫金矿业，或许主要着眼于公司的铜业务，现在可以更多关注黄金给公司带来的增量机会。”紫金矿业董事会秘书郑友诚4月14日在公司202...,2025-04-14 20:13:12,未知来源,2025-09-24 00:27:12,中性偏正,2,公司董秘在业绩交流会上表示黄金利润占比已超过35%，且黄金和铜的回报差距正在缩小，这直接表明公司业务结构正在优化，黄金业务对公司利润贡献度提升,1,这一表态可能引导市场关注点从传统铜业务转向黄金业务，影响投资者对公司价值重估的预期，但未改变行业竞争格局,0.8,立即,3,黄金价格波动风险|实际业务转型进度不及预期,关注
208,【紫金矿业董秘郑友诚：黄金和铜为公司带来的回报正不断缩小】“过去大家关注紫金矿业，或许主要着眼于公司的铜业务，现在可以更多关注黄金给公司带来的增量机会。”紫金矿业董事会秘书郑友诚4月14日在公司202...,2025-04-14 20:13:06,未知来源,2025-09-24 00:25:54,中性偏正,2,消息直接提及公司主营业务结构变化，黄金利润占比已超过35%，显示公司产品结构优化，黄金业务正成为重要增长点，对利润结构有积极影响,1,黄金业务占比提升可能增强公司在贵金属领域的市场地位，但对上下游产业链和行业竞争格局影响有限，主要体现为公司内部业务重心调整,0.8,立即,3,黄金价格波动风险|铜业务回报收缩风险|金属市场价格不确定性,关注
207,【紫金矿业董秘郑友诚：公司会根据锂价走势适当调节投产计划】在今日举行的紫金矿业2025年一季报业绩交流会上，公司董事会秘书郑友诚表示，未来锂价走势会影响公司锂项目投产计划，将根据市场情况适当调节。公司...,2025-04-14 18:05:15,未知来源,2025-09-24 00:25:34,中性偏正,1,政策直接提及公司锂业务发展策略，体现了管理层对市场变化的灵活应对能力。通过根据锂价调节投产计划和控制成本，有助于降低项目风险，但短期内可能延迟部分锂项目的收入贡献。,2,公司通过控制成本和灵活调节投产计划，可能在锂行业低价周期中提升长期竞争力。对上游设备供应商和下游客户影响有限，但可能加剧行业内的成本竞争压力。,0.7,6个月以上,3,锂价持续低迷可能延迟项目盈利时间|新项目投产进度受技术和市场条件影响,关注
206,【紫金矿业：2025年第一季度归母净利润同比增长58.76%】 紫金矿业公告，2025年第一季度实现营业收入789.28亿元，较上年同期增长5.55%。利润总额为146.88亿元，与上年同期相比增长6...,2025-04-11 20:29:43,未知来源,2025-09-24 00:24:53,强烈正面,5,公告直接提及公司2025年第一季度业绩，归母净利润同比增长58.76%，利润总额增长66.37%，净利润增长62.96%，营业收入增长5.55%，显示公司盈利能力显著提升，对收入和利润有直接正面影响,3,强劲的业绩表现可能增强公司在有色金属行业的竞争地位，提升市场份额，对上下游产业链展示公司经营稳定性，可能带动行业整体信心，但具体影响需结合行业周期和市场需求判断,0.95,立即,8,大宗商品价格波动风险|宏观经济环境变化可能影响未来需求|汇率波动对海外业务的影响,强烈关注
204,【20家A股上市公司近两日披露金额最高达10亿元及以上的回购或增持计划公告 宁德时代、中国石油和中国海油涉及金额位列前三】截至发稿，据不完全统计，近两日包括宁德时代、中国石油、中国海油、徐工机械、美的...,2025-04-08 21:52:33,未知来源,2025-09-24 00:20:52,中性偏正,1,公司披露金额达10亿元及以上的回购或增持计划，体现管理层对公司未来发展的信心，可能对股价形成支撑,1,作为大型上市公司参与市场信心维护行动，有助于提升投资者情绪，但对行业基本面影响有限,0.7,1个月内,2,具体实施细节未明确|市场环境变化可能影响计划效果,观望
203,【20家A股上市公司近两日披露金额最高达10亿元及以上的回购或增持计划公告 宁德时代、中国石油和中国海油涉及金额位列前三】截至发稿，据不完全统计，近两日包括宁德时代、中国石油、中国海油、徐工机械、美的...,2025-04-08 21:50:43,未知来源,2025-09-24 00:20:52,中性偏正,1,公司披露金额达10亿元及以上的回购或增持计划，显示对公司价值的信心，可能支撑股价,1,参与大型上市公司集体行动，有助于提升市场整体信心，但对有色金属行业竞争格局无显著影响,0.7,1个月内,2,具体回购/增持规模未披露|计划执行存在不确定性,观望
202,【近30家央国企今日披露金额最高达两亿元及以上的回购或增持计划公告 中国石油控股股东拟28亿-56亿元增持股份】截至发稿，据不完全统计，今日包括徐工机械、国泰君安、京东方A、中远海控、紫金矿业、国电南...,2025-04-08 21:10:15,未知来源,2025-09-24 00:20:52,中性偏正,1,公司披露回购或增持计划，显示管理层对公司价值的认可，可能提升股价信心，但对公司基本面无直接影响,1,作为央国企一员，参与集体行动有助于提升市场对国企板块的信心，但对行业竞争格局影响有限,0.8,1个月内,2,回购/增持具体金额未明确|市场情绪变化可能影响实际效果,观望
201,【紫金矿业：对外出售资产完成交割】紫金矿业(601899.SH)公告称，2025年1月1日，公司澳大利亚全资子公司Norton Gold Fields Pty Ltd（简称“诺顿金田”）与Minera...,2025-04-06 17:07:02,未知来源,2025-09-24 00:20:52,正面,2,直接获得1.565亿澳元现金和价值1000万澳元的股权，增加现金流和投资收益，符合公司'抓大放小'战略，优化资产结构,1,剥离非核心资产有助于聚焦主营业务，提升运营效率，但对产业链和竞争格局影响有限,1.0,立即,3,出售资产可能减少部分黄金产量|MI6股票价值存在市场波动风险,关注
200,                                    【紫金矿业今日大宗交易平价成交300万股，成交额5133万元】 4月3日，紫金矿业大宗交易成交300万股，成交额5133万元，占...,2025-04-03 17:28:57,未知来源,2025-09-24 00:18:36,中性,0,新闻报告紫金矿业大宗交易平价成交300万股，成交额5133万元，占当日总成交额1.37%。交易价格与市场收盘价持平，无折价或溢价，对公司收入/成本/利润无直接影响。,0,大宗交易规模较小且平价成交，表明市场交易正常，无异常信号。对上下游产业链、竞争格局和行业整体无显著间接影响。,0.8,立即,0,大宗交易可能反映大股东或机构资金动向，需后续观察|交易量较小，影响有限,观望
199,【机构本周首次青睐85只个股】Wind数据显示，机构本周首次关注85只个股，其中16股被给予目标价。-四维图新获海通证券给予“优大于市”评级，目标价为9.13至10.95元，该股最新收盘价为8.75元...,2025-03-29 00:08:24,未知来源,2025-09-24 00:18:36,中性偏正,2,新闻与新闻2内容重复，均提及紫金矿业获机构首次关注，但未直接给出评级或目标价，对公司财务指标无直接影响。,3,重复的机构关注可能强化市场正面情绪，间接提升投资者信心，但对行业和竞争无实质性影响。,0.6,1个月内,5,内容重复，影响效应递减|缺乏具体支持数据，效果不确定,关注
198,【机构本周首次青睐85只个股】Wind数据显示，机构本周首次关注85只个股，其中16股被给予目标价。-四维图新获海通证券给予“优大于市”评级，目标价为9.13至10.95元，该股最新收盘价为8.75元...,2025-03-29 00:08:16,未知来源,2025-09-24 00:18:36,中性偏正,2,新闻提及紫金矿业获机构首次关注，但未直接给出评级或目标价，仅表示被机构纳入观察名单，对公司收入/成本/利润无直接影响。,3,机构关注可能提升市场对公司的认知度和投资者兴趣，间接有利于股价表现和融资环境，但对产业链和竞争格局无显著影响。,0.6,1个月内,5,机构关注未伴随具体评级或目标价，影响有限|市场情绪变化可能削弱关注效果,关注
197,【中信建投：紫金矿业业绩再创新高，予“买入”评级】 中信建投证券研报指出，紫金矿业(601899.SH)24年实现归母净利润320.5亿元，同比+51.8%；Q4实现归母净利润76.9亿元，同比+55...,2025-03-27 15:11:58,未知来源,2025-09-24 00:18:36,强烈正面,5,新闻直接提及紫金矿业，报告显示公司2024年归母净利润同比增长51.8%，业绩再创新高。主要产品资源储量增长率均超过双位数，现金分红总额首次突破100亿元，这些因素直接利好公司利润和股东回报。,4,公司资源储量增长和低成本优势增强了其在有色金属行业的竞争地位，构建了坚固的'护城河'，间接提升了行业影响力和市场份额。,0.9,立即,9,Q4净利润环比下降17.0%，可能存在季节性波动或成本压力|有色金属价格波动可能影响未来业绩,强烈关注
196,【中信建投：紫金矿业业绩再创新高，予“买入”评级】 中信建投证券研报指出，紫金矿业(601899.SH)24年实现归母净利润320.5亿元，同比+51.8%；Q4实现归母净利润76.9亿元，同比+55...,2025-03-27 15:11:50,未知来源,2025-09-24 00:16:40,强烈正面,4,研报直接提及公司业绩创历史新高，归母净利润同比大幅增长51.8%，现金分红首次突破100亿元，直接利好公司估值和股东回报,3,公司资源储量大幅增长，构建世界级资产护城河，巩固行业龙头地位，增强对上下游议价能力，提升行业整体竞争力,0.9,立即,8,Q4净利润环比下降17%，可能存在季度波动风险|大宗商品价格波动可能影响未来业绩,强烈关注
194,【东莞证券：紫金矿业业绩大幅提升，维持“买入”评级】 东莞证券研报指出，紫金矿业(601899.SH)24年实现归母净利润320.51亿元，同比+51.76%。主营金属量价齐升，公司业绩大幅提升。金铜...,2025-03-26 15:16:14,未知来源,2025-09-24 00:11:52,强烈正面,4,研报直接确认公司业绩大幅提升，归母净利润同比增长51.76%，主营金属量价齐升，对公司利润产生直接且显著的正面影响,3,金铜价格维持高位预期将提振整个有色金属行业估值，公司丰富的资源储备和多元化矿产组合增强其在行业中的竞争优势，对上下游产业链产生积极拉动作用,0.8,立即,8,全球宏观经济波动可能影响金属价格|矿产项目推进进度不及预期|汇率波动对海外业务的影响,强烈关注
193,【南向资金大幅净买入138.96亿港元】南向资金大幅净买入138.96亿港元，小米集团-W、紫金矿业、盈富基金分别获净买入84.75亿港元、8.81亿港元、7.31亿港元；腾讯控股净卖出额居首，金额为...,2025-03-25 17:35:28,未知来源,2025-09-24 00:11:34,中性偏正,1,政策新闻直接提及紫金矿业获得南向资金净买入8.81亿港元，显示资金面短期积极信号，但对公司收入、成本、利润无直接影响,2,南向资金大幅净流入港股市场，改善市场流动性，可能提升有色金属板块估值；资金青睐资源类股票反映市场对大宗商品景气度的乐观预期,0.7,立即,3,资金流向具有短期性和波动性|南向资金净买入不一定持续|大宗商品价格波动风险,关注
192,【南向资金大幅净买入138.96亿港元】南向资金大幅净买入138.96亿港元，小米集团-W、紫金矿业、盈富基金分别获净买入84.75亿港元、8.81亿港元、7.31亿港元；腾讯控股净卖出额居首，金额为...,2025-03-25 17:35:16,未知来源,2025-09-24 00:07:41,正面,4,南向资金净买入紫金矿业8.81亿港元，显示境外资金对公司的高度认可，直接推动股价上涨,3,大额资金流入提升市场信心，改善流动性，可能吸引更多投资者关注，提升估值水平,0.8,立即,7,资金流向可能短期变化|市场情绪波动影响,关注
191,【国际铜价一度破10000美元/吨，3家公司业绩高增长】据数据宝，国际铜价近期震荡上扬，3月20日，伦敦金属交易所(LME)铜期货价格一度上涨至10046.5美元/吨，为近5个月来首次突破每吨1万美元...,2025-03-24 22:48:12,未知来源,2025-09-24 00:07:41,强烈正面,5,国际铜价突破10000美元/吨，紫金矿业作为主要铜生产商，产品价格上涨直接提升销售收入和利润；公司2024年业绩已确认增长,4,铜价上涨带动整个铜行业景气度提升，成交活跃度增加，行业估值修复，紫金矿业作为龙头受益明显,0.85,立即,9,铜价波动风险|全球经济需求不确定性,强烈关注
190,【国际铜价一度破10000美元/吨，3家公司业绩高增长】据数据宝，国际铜价近期震荡上扬，3月20日，伦敦金属交易所(LME)铜期货价格一度上涨至10046.5美元/吨，为近5个月来首次突破每吨1万美元...,2025-03-24 22:44:42,未知来源,2025-09-24 00:07:41,强烈正面,5,国际铜价突破10000美元/吨，紫金矿业作为主要铜生产商，产品价格上涨直接提升销售收入和利润；公司2024年业绩已确认增长,4,铜价上涨带动整个铜行业景气度提升，成交活跃度增加，行业估值修复，紫金矿业作为龙头受益明显,0.85,立即,9,铜价波动风险|全球经济需求不确定性,强烈关注
