title,date,url,source,content
紫金矿业子公司紫金黄金国际拟香港联交所上市 发行价71.59港元/股,2025-09-19 10:32:23,http://finance.eastmoney.com/a/202509193518296017.html,上海证券报·中国证券网,上证报中国证券网讯（记者王乔琪）紫金矿业9月19日早间发布公告，公司收到所属子公司紫金黄金国际有限公司（简称“紫金黄金国际”）通知，其已于当日在香港联交所网站刊登发行上市的招股说明书。 紫金黄金国际本次全球发售基础发行股数为3.49亿股（视乎超额配售权行使与否而定；约占全球发售完成后已发行的紫金黄金国际股份总数13.30%），其中，初步安排香港公开发售3489.91万股（可予重新分配），约占全球发售基础发行股数的10%；国际发售3.14亿股（包括优先发售项下的1744.96万股预留股份，可予重新分配及视乎超额配售权行使与否而定），约占全球发售基础发行股数的90%。 紫金黄金国际本次发行的价格确定为71.59港元/股。紫金黄金国际香港公开发售于2025年9月19日开始，预计于2025年9月24日结束。紫金黄金国际本次发行的新股预计于2025年9月29日在香港联交所挂牌并开始上市交易。（文章来源：上海证券报·中国证券网）
每股71.59港元 紫金矿业旗下紫金黄金国际启动港股公开发售，9月29日挂牌交易,2025-09-19 09:38:41,http://finance.eastmoney.com/a/202509193518197276.html,财中社,9月19日，紫金矿业（601899/02899）发布公告，拟分拆所属子公司紫金黄金国际有限公司至香港联合交易所主板上市。 公告指出，紫金黄金国际已于2025年9月19日在香港联交所网站刊登招股说明书，计划全球发售基础发行股数为3.49亿股，约占全球发售完成后已发行股份总数的13.30%。其中，香港公开发售3490万股，约占基础发行股数的10%；国际发售3.14亿股，约占基础发行股数的90%。 此外，公告提到，整体承销商可行使超额配售权，要求紫金黄金国际按发售价配发最多5235万股，若超额配售权悉数行使，最大发行股数将达到4.01亿股，约占全球发售完成及超额配售权行使后已发行股份总数的15%。 本次发行的价格确定为71.59港元/股，香港公开发售于2025年9月19日开始，预计于2025年9月24日结束，新股预计于2025年9月29日挂牌交易。 2025年中期，紫金矿业实现收入1677.11亿元，归母净利润232.92亿元。（文章来源：财中社）
有色金属行业资金流出榜：北方稀土、紫金矿业等净流出资金居前,2025-09-18 17:23:20,http://finance.eastmoney.com/a/202509183517368327.html,证券时报网,沪指9月18日下跌1.15%，申万所属行业中，今日上涨的有3个，涨幅居前的行业为电子、通信、社会服务，涨幅分别为0.93%、0.19%、0.03%。跌幅居前的行业为有色金属、综合，跌幅分别为3.56%、2.85%。有色金属行业位居今日跌幅榜首位。 资金面上看，两市主力资金全天净流出1084.07亿元，主力资金净流入的行业仅有2个，煤炭行业净流入资金2.35亿元；社会服务行业净流入资金3223.90万元。 主力资金净流出的行业有29个，非银金融行业主力资金净流出规模居首，全天净流出资金189.70亿元，其次是有色金属行业，净流出资金为127.48亿元，净流出资金较多的还有电力设备、计算机、电子等行业。 有色金属行业今日下跌3.56%，全天主力资金净流出127.48亿元，该行业所属的个股共137只，今日上涨的有9只；下跌的有126只。以资金流向数据进行统计，该行业资金净流入的个股有14只，净流入资金居首的是山金国际，今日净流入资金7743.13万元，紧随其后的是新莱福、深圳新星，净流入资金分别为1732.85万元、1409.86万元。有色金属行业资金净流出个股中，资金净流出超亿元的有37只，净流出资金居前的有北方稀土、紫金矿业、中国稀土，净流出资金分别为14.87亿元、10.38亿元、6.09亿元。（数据宝） 有色金属行业资金流入榜代码简称今日涨跌幅（%）今日换手率（%）主力资金流量（万元）000975山金国际-3.191.777743.13301323新莱福-1.245.851732.85603978深圳新星-0.108.781409.86002295精艺股份-1.115.341081.64601702华峰铝业-3.101.01927.97002160常铝股份-4.254.31782.38688102斯瑞新材0.311.83739.71301622英思特1.0818.91699.80300855图南股份0.393.19685.61603045福达合金-1.792.80437.86002240盛新锂能-3.353.09354.76603132金徽股份-3.440.64341.11688456有研粉材1.813.45158.10688231隆达股份-3.002.66105.42 有色金属行业资金流出榜代码简称今日涨跌幅（%）今日换手率（%）主力资金流量（万元）600111北方稀土-4.455.71-148684.93601899紫金矿业-2.591.28-103758.39000831中国稀土-5.477.11-60912.24002460赣锋锂业-3.868.14-43144.28300748金力永磁-4.437.91-40856.34603799华友钴业-2.194.61-38260.67000737北方铜业-5.2513.46-36563.58603993洛阳钼业-3.281.53-36240.67002466天齐锂业-3.663.44-33775.46600489中金黄金-3.372.30-32826.35600362江西铜业-6.413.82-27878.06000878云南铜业-6.237.44-26141.92601600中国铝业-3.902.16-25629.65600988赤峰黄金-3.864.17-25418.62002428云南锗业-4.439.43-23014.22600549厦门钨业-3.773.77-22648.25002716湖南白银-6.4910.19-21103.94002182宝武镁业-4.809.52-20010.16600392盛和资源-3.385.63-19793.16300618寒锐钴业-3.4710.14-18869.30注：本文系新闻报道，不构成投资建议，股市有风险，投资需谨慎。（文章来源：证券时报网）
藏格矿业：紫金矿业入主后，藏格矿业仍将战略重心聚焦于钾、锂上游资源的开发与运营,2025-09-17 21:36:49,http://finance.eastmoney.com/a/202509173516237266.html,每日经济新闻,每经AI快讯，有投资者在投资者互动平台提问：我司曾参股重庆骏力（现已注销）扩展锂电中下游产业链，现在紫金已入主藏格，而紫金正在发力锂电中下游产业链，我司是否可能在紫金主导下，参与其诸多项目？ 藏格矿业（000408.SZ）9月17日在投资者互动平台表示，紫金矿业入主后，藏格矿业仍将战略重心聚焦于钾、锂上游资源的开发与运营。关于锂电中下游产业链相关规划。具体情况请关注公司后续公告。（文章来源：每日经济新闻）
紫金矿业阿根廷年产2万吨碳酸锂项目投产,2025-09-14 16:40:36,http://finance.eastmoney.com/a/202509143513054442.html,新京报,新京报贝壳财经讯据紫金矿业官网消息，阿根廷当地时间9月12日，紫金矿业旗下锂业科思3Q锂盐湖年产2万吨碳酸锂项目投产仪式在卡塔马卡省菲安巴拉市举行，标志着紫金矿业在南美锂资源开发实现关键突破，新能源产业布局迈入新阶段。（文章来源：新京报）
