news_id,original_title,original_date,original_source,analysis_time,sentiment,direct_impact_score,direct_impact_desc,indirect_impact_score,indirect_impact_desc,certainty,time_to_effect,overall_score,risk_factors,action_suggestion
80,"紫金矿业半年净赚233亿元，超2023年全年盈利

8月26日，紫金矿业(601899.SH/02899.HK)发布公告称，2025年上半年公司营业收入1677.11亿元，同比增长11.50%；归属于...",2025-08-26 21:46:51,未知来源,2025-09-22 17:58:28,强烈正面,5,公告直接显示公司2025年上半年净利润233亿元，同比增长54.41%，创历史新高且超2023年全年。主要受益于金价上涨（上半年均价同比涨39.21%）和铜价支撑，黄金业务毛利占比38.6%，铜业务占比38.5%。营收增长11.50%至1677亿元，盈利能力大幅提升。,4,通过并购（如加纳阿基姆金矿、藏格矿业、哈萨克斯坦金矿）扩大资源储备和产能，提升行业竞争力；金价上涨趋势可能持续受益于避险情绪，但需关注全球宏观经济波动对金属价格的影响。行业龙头地位巩固（全球黄金企业第1位），但对上下游议价能力需观察成本变化。,0.9,立即,9,金价回调风险，若避险情绪减弱可能导致价格下跌|铜需求受全球经济增速影响，潜在需求波动|并购整合风险，新项目运营效率不及预期,强烈关注
81,"港股公告精选｜中石油上半年净赚约840亿元 紫金矿业中期盈利同比增逾5成

财联社8月26日讯 财联社为您带来今日港股重要公告 1）业绩速递 中国石油股份(00857.HK)：上半年收入14500.9...",2025-08-26 20:35:17,未知来源,2025-09-22 17:58:34,正面,4,政策新闻直接提及紫金矿业，其中期净利润同比大幅增长54.4%，达到232.92亿元，收入同比增长11.5%。这表明公司盈利能力和经营效率显著提升，对股价有直接正面影响。,2,紫金矿业的业绩增长可能反映有色金属行业整体需求稳健，尤其是黄金和铜的价格支撑。同时，公司作为行业龙头，其业绩向好可能提振整个有色金属板块的市场情绪，但对上下游产业链和竞争格局的间接影响有限。,0.9,立即,6,全球经济波动可能影响有色金属价格|行业政策变化或环保要求增加成本,关注
82,"紫金矿业：上半年归母净利润同比增长54.41%

紫金矿业8月26日公告，2025年上半年营业收入1677.11亿元，同比增长11.50%。归属于上市公司股东的净利润为232.92亿元，同比增长54....",2025-08-26 19:19:08,未知来源,2025-09-22 17:58:40,强烈正面,5,公告直接提及公司业绩，显示上半年归母净利润同比增长54.41%，营业收入增长11.50%，并宣布现金分红，直接利好公司利润和股东回报,3,强劲业绩可能提升公司在有色金属行业的竞争地位，增强市场信心，对上下游产业链有正向拉动作用，行业整体可能因龙头公司表现而受到关注,1.0,立即,8,宏观经济波动可能影响金属需求|金属价格波动风险|未来业绩增长可持续性不确定,强烈关注
83,"紫金矿业：2025年上半年净利润232.92亿元，同比增长54.41%

每经AI快讯，8月26日，紫金矿业公告，2025年上半年营业收入1677.11亿元，同比增长11.50%。净利润232.92亿...",2025-08-26 19:15:37,未知来源,2025-09-22 17:58:49,强烈正面,5,公告直接披露公司2025年上半年优异财务表现：净利润232.92亿元，同比增长54.41%，远超行业平均水平；营业收入1677.11亿元，同比增长11.50%；同时宣布每10股派现2.2元，直接体现盈利能力增强和股东回报提升,4,强劲业绩表现可能增强公司在有色金属行业的龙头地位，提升对上下游议价能力；高增长可能吸引更多投资者关注有色金属板块，但对竞争格局影响相对有限，行业整体受益于龙头公司的示范效应,1.0,立即,9,未来金属价格波动可能影响持续盈利能力|宏观经济环境变化可能影响需求|海外运营可能面临地缘政治风险,强烈关注
84,"紫金矿业：上半年净利润同比增长54.41%

南财智讯8月26日电，紫金矿业发布2025年半年度报告，报告期实现营业收入1677.11亿元，同比增长11.50%；归属上市公司股东的净利润232.92亿...",2025-08-26 19:11:52,未知来源,2025-09-22 17:58:55,强烈正面,5,业绩公告直接提及公司，净利润同比增长54.41%远超营收增速，显示盈利能力显著提升，每股收益增长利好股东回报,3,强劲业绩可能提升行业信心，巩固公司在有色金属行业的龙头地位，但对上下游议价能力和竞争格局影响有限,1.0,立即,8,未来金属价格波动风险|成本控制持续性风险|宏观经济需求不确定性,强烈关注
85,"紫金矿业：上半年净利润同比增长54%

紫金矿业(601899.SH)发布2025年半年度报告，公司实现营业收入1677.11亿元，同比增长11.50%；归属于上市公司股东的净利润为232.92亿元，...",2025-08-26 19:07:11,未知来源,2025-09-22 17:59:02,强烈正面,5,业绩报告直接提及公司，显示营业收入1677.11亿元（同比增长11.50%）和净利润232.92亿元（同比增长54.41%），表明公司盈利能力和经营效率显著提升，对利润有直接积极影响。,3,强劲的业绩可能增强公司在有色金属行业的竞争力，提升市场份额，并对上游供应商和下游客户产生正面溢出效应，彰显行业龙头地位，但间接影响相对较小，因报告主要反映公司自身表现。,0.95,立即,8,大宗商品价格波动可能影响未来利润|宏观经济下行风险或降低需求|汇率变化对国际业务成本的影响,强烈关注
86,"紫金矿业今日大宗交易平价成交1022.3万股，成交额2.29亿元

8月26日，紫金矿业大宗交易成交1022.3万股，成交额2.29亿元，占当日总成交额的5.26%，成交价22.39元，较市场收盘价2...",2025-08-26 17:40:43,未知来源,2025-09-22 17:59:10,中性,0,大宗交易为市场中性行为，成交价与收盘价持平，未产生折溢价，不直接影响公司基本面、收入或利润,0,交易未改变行业竞争格局或产业链关系，仅反映股东或机构资金调配需求，对市场情绪无显著导向作用,0.9,立即,0,大额减持可能暗示股东资金需求或看空情绪|若后续持续出现大宗交易可能引发市场流动性担忧,观望
87,"紫金矿业今日大宗交易平价成交1000万股，成交额2.22亿元

8月25日，紫金矿业大宗交易成交1000万股，成交额2.22亿元，占当日总成交额的3.22%，成交价22.21元，较市场收盘价22.21...",2025-08-25 17:38:16,未知来源,2025-09-22 17:59:15,中性,0,该消息仅为大宗交易信息，未直接提及公司主营业务，对公司收入、成本、利润无直接影响。平价交易表明交易双方对当前股价认可，未产生折价或溢价。,0,大宗交易属于正常市场行为，未改变公司上下游产业链关系，未影响行业竞争格局，对有色金属行业整体无显著影响。,0.9,立即,0,大股东或机构减持可能引发市场担忧|大宗交易规模较大可能短期内增加市场供给,观望
88,"紫金矿业成立稀贵金属公司 注册资本50亿元

人民财讯8月25日电，企查查APP显示，近日，福建紫金稀贵金属有限公司成立，注册资本50亿元，经营范围包含贵金属冶炼；以自有资金从事投资活动等。企查查股权...",2025-08-25 09:38:54,未知来源,2025-09-22 17:59:22,正面,3,政策直接提及紫金矿业成立全资子公司，涉足稀贵金属冶炼领域。50亿元注册资本显示公司战略投入力度大，有望拓展新的收入来源，但对短期利润影响有限，需投入期。,4,延伸产业链至稀贵金属，增强上游资源整合能力；可能提升公司在有色金属行业的综合竞争力；对行业有示范效应，推动产业升级。,0.8,6个月以上,7,新业务投资回报周期长|稀贵金属市场价格波动风险|冶炼业务环保政策趋严,关注
89,"紫金矿业大宗交易成交390.00万股 成交额8057.40万元

紫金矿业8月22日大宗交易平台出现一笔成交，成交量390.00万股，成交金额8057.40万元，大宗交易成交价为20.66元。该笔交易...",2025-08-22 23:43:32,未知来源,2025-09-22 17:59:28,中性,0,该新闻仅为大宗交易信息，未直接提及公司主营业务或经营政策，对公司收入、成本、利润无直接影响,-1,大额大宗交易可能反映大股东或机构投资者的减持行为，近5日主力资金净流出12.63亿元显示资金面承压，融资余额增加但股价下跌反映市场分歧,0.7,立即,-2,大宗交易折溢价率为0%但近5日股价累计下跌2.96%|主力资金持续净流出显示短期抛压|融资余额大幅增加但股价下跌可能蕴含风险,观望
90,"紫金矿业成立稀贵金属公司，注册资本50亿

天眼查工商信息显示，近日，福建紫金稀贵金属有限公司成立，法定代表人为江城，注册资本50亿人民币，经营范围为贵金属冶炼、以自有资金从事投资活动、非煤矿山矿产资...",2025-08-22 19:24:23,未知来源,2025-09-22 17:59:36,正面,3,政策直接提及紫金矿业成立全资子公司，注册资本50亿元，将拓展贵金属冶炼等业务，有望增加新的收入来源，但短期内可能增加资本开支和成本压力。,2,新公司可能增强紫金矿业在稀贵金属领域的竞争力，优化产业链布局，但对上下游和行业整体影响有限，竞争格局变化较小。,0.8,6个月以上,5,新业务初期可能面临运营和整合风险|贵金属市场价格波动可能影响盈利稳定性|资本开支增加可能导致短期财务压力,关注
91,"紫金矿业成立稀贵金属公司

南方财经8月22日电，天眼查工商信息显示，近日，福建紫金稀贵金属有限公司成立，法定代表人为江城，注册资本50亿人民币，经营范围为贵金属冶炼、以自有资金从事投资活动、非煤矿山...",2025-08-22 18:52:43,未知来源,2025-09-22 17:59:44,正面,3,政策直接提及紫金矿业成立全资稀贵金属子公司，注册资本50亿元，业务范围涵盖贵金属冶炼、投资和非煤矿山开采。这将直接拓展公司业务至稀贵金属领域，有望增加新的收入来源，但初期可能增加资本开支和运营成本。,2,通过进入稀贵金属领域，紫金矿业可能增强上游资源控制力，优化产业链布局；竞争格局上，公司可能利用规模优势抢占市场份额，但对行业整体影响有限，主要集中于企业自身战略扩张。,0.8,6个月以上,5,新业务初期投入大，可能短期拖累利润|稀贵金属市场价格波动风险|项目运营和投资回报存在不确定性,关注
92,"紫金矿业今日大宗交易平价成交390万股，成交额8057.4万元

8月22日，紫金矿业大宗交易成交390万股，成交额8057.4万元，占当日总成交额的2.56%，成交价20.66元，较市场收盘价20....",2025-08-22 17:35:25,未知来源,2025-09-22 17:59:51,中性,0,该大宗交易为市场中性行为，成交价与收盘价持平，未产生折价或溢价。交易规模相对公司市值（3000亿元）和日常交易量占比较小（2.56%），对公司基本面、收入、成本及利润无直接影响,0,该交易为股东或机构间的股份转让，未改变公司股权结构或控制权，对上下游产业链、行业竞争格局及有色金属行业整体无实质性影响,1.0,立即,0,大宗交易可能反映大股东或机构资金需求，后续若持续出现大额减持可能引发市场担忧|交易信息透明度不足，未知买卖双方身份及交易动机,观望
93,"紫金矿业间接控股子公司40万元项目环评获原则同意

“A股绿色报告”项目监控到的数据显示，紫金矿业（SH601899）间接控股子公司连城紫金矿业有限公司连城紫金自用柴油橇装站建设项目环评审批获原则同意...",2025-08-19 18:56:03,未知来源,2025-09-22 18:00:04,中性,0,政策直接提及公司间接控股子公司的小型基础设施项目，但项目规模极小（仅40万元），相对于公司3000亿市值可忽略不计，对收入/成本/利润无实质影响。,1,环评获批体现公司合规经营能力，可能提升ESG形象，但对上下游产业链、竞争格局及行业整体无显著影响。,0.9,立即,1,项目规模过小无实际经济意义|可能被市场过度解读为炒作题材,观望
94,"紫金矿业间接控股子公司865万元项目环评获原则同意

“A股绿色报告”项目监控到的数据显示，紫金矿业（SH601899）间接控股子公司连城紫金矿业有限公司连城紫金姑田铜多金属矿选矿区临时排土场环评审批...",2025-08-19 18:56:02,未知来源,2025-09-22 18:00:12,中性偏正,1,政策直接提及公司间接控股子公司，环评获原则同意有利于项目推进，但865万元投资额相对公司3000亿市值影响微乎其微，对收入/成本/利润无显著直接影响,2,环评通过体现公司合规经营能力，有利于维持正常生产运营，对上下游产业链无负面影响；增强公司在环保监管趋严背景下的竞争优势；对行业示范积极合规经营的重要性,0.8,1-3个月,3,项目投资额极小，对业绩几无贡献|环评仅为原则同意，后续仍可能存在变数|环保政策持续趋严可能增加合规成本,观望
95,"有色板块震荡拉升 紫金矿业创历史新高

南方财经8月13日电，有色板块日内震荡拉升，工业金属方向领涨，紫金矿业、洛阳钼业双双涨超3%创历史新高， （文章来源：南方财经网）...",2025-08-13 10:23:41,未知来源,2025-09-22 18:00:18,中性偏正,1,新闻未直接提及政策，但报道紫金矿业股价创历史新高且涨超3%，反映市场对公司短期表现的积极认可，可能提升投资者信心和流动性,2,有色板块整体拉升及工业金属领涨，可能受益于宏观经济预期改善或需求增长，间接利好公司上下游产业链；行业景气度提升可能强化公司竞争地位,0.7,立即,3,市场情绪波动可能导致股价回调|行业周期性风险及金属价格不确定性,关注
96,"有色板块震荡拉升 紫金矿业、洛阳钼业双双创历史新高

每经AI快讯，8月13日，有色板块日内震荡拉升，工业金属方向领涨，紫金矿业、洛阳钼业双双涨超3%创历史新高，此前丽岛新材、东方钽业涨停，电工合金涨...",2025-08-13 10:17:12,未知来源,2025-09-22 18:00:27,中性偏正,1,新闻直接提及公司股价创历史新高，显示市场对公司的高度认可，但并非政策驱动，对公司基本面无直接影响,3,有色板块整体走强，工业金属领涨，反映行业景气度提升，可能受益于宏观经济预期改善或供需格局优化，有利于公司产品价格和需求,0.7,立即,4,板块上涨可能受短期情绪驱动，持续性存疑|宏观经济波动可能影响金属价格|行业竞争加剧风险,关注
97,"紫金矿业获坦桑尼亚港口及码头特许经营权

据紫金矿业消息，当地时间8月5日，紫金矿业与坦桑尼亚政府在达累斯萨拉姆港正式签署协议，获得达累港马林迪码头与基戈马港口的特许经营权。此外，为配合全链条物流体系...",2025-08-12 11:17:54,未知来源,2025-09-22 18:00:32,正面,3,政策直接提及紫金矿业获得港口特许经营权，将降低公司物流成本，提升运营效率，对利润产生积极影响,2,增强公司在非洲地区的产业链整合能力，改善竞争地位，但对行业整体影响有限,0.8,6个月以上,5,海外政治风险|项目投资回报周期较长,关注
98,"紫金矿业盘中创历史新高

紫金矿业股价创出历史新高，截至10:28，该股上涨1.03%，股价报20.51元，成交量4955.56万股，成交金额10.13亿元，换手率0.24%，该股最新A股总市值达42...",2025-08-08 11:07:53,未知来源,2025-09-22 18:00:40,强烈正面,4,新闻直接报道公司股价创历史新高，显示市场对公司的高度认可。公司一季度净利润同比增长62.39%，上半年业绩预告净利润同比增长54%，业绩表现优异，直接利好股价,3,行业内整体涨幅0.51%，紫金矿业作为行业龙头表现突出，可能带动整个有色金属板块情绪。机构研报给予目标价25.92元，较当前股价有较大上涨空间，增强市场信心,0.9,立即,8,融资余额近10日减少3131万元，显示部分资金获利了结|有色金属行业周期性较强，受宏观经济影响大|股价已处历史高位，存在技术性调整风险,强烈关注
