news_id,original_title,original_date,original_source,analysis_time,sentiment,direct_impact_score,direct_impact_desc,indirect_impact_score,indirect_impact_desc,certainty,time_to_effect,overall_score,risk_factors,action_suggestion
299,【东方证券：维持紫金矿业“买入”评级，目标价31.79元】东方证券研报指出，紫金矿业25H1实现归母净利润232.9亿元，yoy+54.41%，Q2单季度实现归母净利润131.25亿元，qoq+29....,2025-09-22 14:13:40,未知来源,2025-09-24 01:24:59,强烈正面,4,研报维持买入评级，目标价31.79元，认可公司业绩增长（25H1净利润yoy+54.41%），预期铜金业务量价齐升,3,美联储降息周期开启有助于黄金、铜等金属上涨行情，利好行业整体；研报可能提升市场对公司基本面的认可度,0.9,1-3个月,7,研报预测基于假设，实际业绩可能不及预期|金属价格受全球经济影响，存在波动风险,强烈关注
298,【杠杆资金本周重仓股曝光 中芯国际居首】Wind统计显示，本周（9月15日至9月19日）共有1985只个股获融资净买入，净买入金额在千万元以上的有1125只，共有200只融资净买入额超1亿元。中芯国际...,2025-09-21 20:50:22,未知来源,2025-09-24 01:24:59,中性偏负,-2,紫金矿业遭融资净卖出9.64亿元，显示杠杆资金短期看空，可能带来股价下行压力,-1,融资资金流出可能影响市场情绪，短期内降低投资者信心,0.7,立即,-3,融资资金变动可能只是短期行为|公司基本面未发生实质变化,观望
297,港交所消息：9月15日，摩根大通公司持有的紫金矿业H股多头头寸从10.04%增至10.91%。...,2025-09-19 17:21:28,未知来源,2025-09-24 01:24:59,正面,2,摩根大通增持紫金矿业H股多头头寸，显示机构投资者信心增强，可能带来增量资金和股价支撑,1,大型机构增持可能引发其他投资者关注，提升市场对公司股票的认可度,0.8,立即,3,增持比例有限，影响相对温和|市场整体情绪可能对冲个别机构行为,关注
296,紫金矿业：H股持有人可获预留股份。...,2025-09-17 22:39:15,未知来源,2025-09-24 01:23:03,中性偏正,1,H股持有人可获得预留股份，体现了对H股股东的权益保护，有利于维持投资者关系,0,对H股股东的优待政策属于公司治理范畴，对行业和竞争格局无显著影响,0.85,立即,1,可能引发A股股东的不满情绪|预留股份的具体用途和影响尚不明确,观望
295,紫金矿业：每 344 股 H 股可获配 1 股预留股份。...,2025-09-17 22:39:06,未知来源,2025-09-24 01:23:03,中性偏正,1,H股配股方案明确，每344股配1股，比例较低，对现有股东稀释效应有限,0,配股方案属于公司常规资本运作，对行业竞争格局和产业链无明显影响,0.9,1个月内,1,配股可能被市场解读为资金需求紧张|若配股价过低可能影响每股收益,观望
294,紫金矿业： 紫金黄金国际全球发行规模、结构及预期时间表尚未最终确定。...,2025-09-17 22:23:27,未知来源,2025-09-24 01:23:03,中性偏负,-1,紫金黄金国际发行计划未确定，增加了不确定性，可能延迟融资进程和国际化扩张步伐,-1,国际发行延期可能影响公司全球资源布局能力，在行业国际化竞争中暂时处于不利位置,0.6,3-6个月,-2,全球发行存在监管和政策风险|国际市场环境变化可能影响发行效果,观望
293,港交所消息：9月10日，花旗集团持有的紫金矿业H股空头头寸从1.28%降至0.71%。...,2025-09-16 17:20:22,未知来源,2025-09-24 01:23:03,正面,2,花旗集团大幅减少紫金矿业H股空头头寸，表明机构看空情绪减弱，可能缓解股价下行压力,1,大型投行减少空头头寸可能引发其他机构跟随，改善市场情绪，但对产业链和竞争格局无直接影响,0.8,立即,3,消息来源未知，可靠性存疑|空头头寸减少不一定代表看多，可能只是仓位调整,关注
292,港交所消息：9月10日，花旗集团持有的紫金矿业H股多头头寸从6.69%降至6.09%。...,2025-09-16 17:15:00,未知来源,2025-09-24 01:22:09,中性偏负,-2,花旗集团作为重要机构投资者，减持H股多头头寸（从6.69%降至6.09%）可能引发市场跟风抛售，对股价造成短期压力。减持行为可能被市场解读为机构对公司短期前景持谨慎态度。,-1,大股东减持可能影响市场情绪和投资者信心，但需注意这仅是单一机构的仓位调整，不一定代表公司基本面发生变化。减持原因可能包括机构自身的仓位管理需求而非对公司看空。,0.9,立即,-3,可能引发其他投资者跟风抛售|市场情绪短期受影响|减持原因不明可能引发猜测,观望
291,紫金矿业表示，其旗下子公司紫金国际金矿已向香港证券交易所提交了有关上市的聆讯后资料集。...,2025-09-14 19:44:16,未知来源,2025-09-24 01:22:09,正面,3,子公司分拆上市若成功，可为紫金矿业带来以下直接影响：1) 通过股权融资获得发展资金，减轻母公司资本开支压力；2) 可能通过股权稀释获得一次性投资收益；3) 提升金矿业务板块的估值透明度。,2,分拆上市有助于突出金矿业务价值，获得独立估值，可能带动母公司整体估值重估。同时为金矿业务提供独立的融资平台，有利于该业务的独立发展和行业并购扩张。,0.7,3-6个月,5,上市审批存在不确定性|市场环境可能影响发行估值|分拆过程复杂且耗时,关注
290,【紫金矿业阿根廷年产2万吨碳酸锂项目投产】据紫金矿业消息，阿根廷当地时间9月12日，紫金矿业旗下锂业科思3Q锂盐湖年产2万吨碳酸锂项目投产仪式在卡塔马卡省菲安巴拉市举行。据了解，当前，二期项目许可审批...,2025-09-14 13:05:34,未知来源,2025-09-24 01:22:09,强烈正面,4,项目直接涉及紫金矿业，年产2万吨碳酸锂项目正式投产将直接为公司创造新的收入来源和利润增长点。二期项目规划产能4万吨/年，全部达产后年产能预计达6-8万吨，将显著提升公司营收和利润。,3,此举标志着紫金矿业成功进军锂电新能源赛道，实现了从传统有色金属向战略新兴材料的业务拓展，增强了公司抵御单一金属价格波动的能力，提升了在新能源产业链中的战略地位。,0.9,立即,7,碳酸锂市场价格波动风险|项目产能爬坡不及预期|阿根廷政策环境变化风险,强烈关注
289,【龙净环保：全资子公司紫金龙净拟投资3.99亿美元建设刚果（金）凯兰庚水电站项目】龙净环保公告，全资子公司紫金龙净通过其全资子公司龙净香港在刚果（金）收购了GML公司80%股份，获取了140MW刚果（...,2025-09-12 16:11:18,未知来源,2025-09-24 01:22:09,正面,3,新闻虽未直接提及紫金矿业，但项目建成后90%电量将优先供应紫金在刚果（金）的权属企业。这将显著降低紫金矿业在当地采矿业务的电力成本，提升利润空间。,2,稳定的低成本电力供应将增强紫金矿业在刚果（金）矿山运营的竞争力，并可能为其未来扩产提供能源保障。对行业而言，体现了矿业公司通过投资基础设施来保障供应链稳定的趋势。,0.8,6个月以上,5,项目建设和并网存在延期风险|刚果（金）地缘政治风险|项目投资巨大但由龙净环保实施，紫金矿业仅为电力采购方,关注
288,【花旗在紫金矿业的多头仓位增至6.78%】据港交所文件，花旗集团在紫金矿业(2899.HK)的多头仓位于9月5日增至6.78%，此前为6.19%。...,2025-09-11 18:06:09,未知来源,2025-09-24 01:19:40,正面,2,花旗集团增持多头仓位，表明另一大型机构看好公司，可能带来资金流入和股价积极信号,1,机构增持可能增强市场信心，但对产业链和竞争格局无直接影响,0.8,立即,3,增持幅度有限，影响可能被市场波动稀释|机构持仓变化可能基于短期策略,关注
287,【紫金矿业2025年员工持股计划非交易过户完成】紫金矿业公告2025年员工持股计划实施进展。2025年6月26日，公司2025年第一次临时股东会审议通过相关议案。9月11日，公司收到《过户登记确认书》...,2025-09-11 17:36:05,未知来源,2025-09-24 01:19:40,正面,3,员工持股计划完成过户，将员工利益与公司绑定，可能提升员工积极性和效率，间接促进公司业绩,1,员工激励可能提升运营效率，但对行业竞争和产业链无显著影响,0.9,6个月以上,4,锁定期较长（24个月），短期无直接变现压力|分配取决于业绩考核，存在不确定性,关注
286,【紫金矿业今日大宗交易溢价成交1144.2万股，成交额2.88亿元】9月10日，紫金矿业大宗交易成交1144.2万股，成交额2.88亿元，占当日总成交额的4.89%，成交价25.19元，较市场收盘价2...,2025-09-10 17:30:44,未知来源,2025-09-24 01:19:40,中性偏正,1,大宗交易溢价成交显示有投资者愿意以高于市场价格买入，可能反映短期需求积极，但对公司基本面无直接影响,0,大宗交易对上下游产业链和竞争格局无显著影响，仅反映个别交易行为,0.7,立即,1,大宗交易可能涉及内部人或短期投资者，持续性存疑|溢价幅度极小，影响有限,观望
285,港交所消息：9月4日，摩根大通持有的紫金矿业H股多头仓位从9.39%增至9.92%。...,2025-09-09 17:23:41,未知来源,2025-09-24 01:19:40,正面,2,摩根大通增持紫金矿业H股仓位，显示机构投资者对公司前景的信心，可能带来增量资金和股价支撑,1,大型机构增持可能提升市场情绪，吸引其他投资者关注，但对产业链和竞争格局无直接影响,0.8,立即,3,增持比例较小，影响有限|市场整体情绪可能抵消积极影响,关注
284,【港股收评：恒生指数涨1.43%，恒生科技指数涨1.95%】港股收盘，恒生指数涨1.43%，恒生科技指数涨1.95%。港股科技ETF（159751）涨2.5%，恒生港股通ETF（159318）涨1.5...,2025-09-05 16:13:00,未知来源,2025-09-24 01:18:19,中性,1,港股大盘上涨带动紫金矿业H股跟涨5.85%，属于市场整体行情带动，非公司基本面变化,1,反映有色金属板块受到市场关注，行业整体估值可能提升，但个股表现仍需基本面支撑,0.6,立即,2,大盘回调风险|行业周期性波动|跟涨行情缺乏持续性,观望
283,【紫金矿业A股创收盘价历史新高】2025年9月5日，紫金矿业A股股价大涨近6%，收报25.27元/股，A股市值超过5200亿元，双双创出历史新高。以A股市值排名，紫金矿业跻身第十九位。...,2025-09-05 15:32:48,未知来源,2025-09-24 01:18:19,中性偏正,2,股价创新高反映市场对公司基本面的认可，但本身不直接影响公司经营业绩和财务状况,2,提升公司市场形象和投资者关注度，有利于后续融资和市值管理，但可能面临估值回调压力,1.0,立即,4,股价高位回调风险|市场情绪变化风险|估值过高可能限制上涨空间,观望
282,【紫金矿业董事长陈景河与塞尔维亚总统武契奇在京会谈】9月3日下午，紫金矿业董事长陈景河与来华访问的塞尔维亚总统武契奇在北京会谈。武契奇总统表示，紫金矿业在塞尔维亚的重大投资项目有力带动了塞矿业行业的复...,2025-09-04 18:19:28,未知来源,2025-09-24 01:18:19,正面,3,与塞尔维亚政府的深度合作将直接保障公司在塞现有项目的稳定运营，可能获得更多政策支持和资源开发机会,2,增强公司在欧洲市场的政治关系和资源获取能力，提升国际形象，有利于其他海外项目的拓展,0.7,3-6个月,5,地缘政治风险|塞尔维亚政策连续性风险|海外运营成本控制挑战,关注
281,【紫金黄金据悉计划在香港进行30亿美元的首次公开募股】 据知情人士透露，中国紫金矿业集团股份有限公司计划将旗下国际金矿子公司在香港上市，首次公开募股（IPO）的筹资规模可能超过30亿美元，有望使其成为...,2025-09-04 12:01:09,未知来源,2025-09-24 01:18:19,强烈正面,4,子公司分拆上市将直接为紫金矿业带来30亿美元资金，改善母公司财务状况，提升资本实力，有利于降低负债率和融资成本,3,提升公司在国际资本市场的影响力，增强品牌价值，有利于未来海外业务拓展和资源并购,0.8,1-3个月,7,IPO时间可能推迟|市场环境变化可能影响发行定价|分拆后可能影响母公司对子公司的控制力,强烈关注
280,【9月3日增减持汇总】据统计，9月3日，盘后艾布鲁披露增持情况。包括紫金矿业、天虹股份、翔丰华、*ST万方、彤程新材、纵横通信、信科移动、野马电池、宝兰德、至纯科技、聚合顺、莎普爱思在内的12家A股上...,2025-09-03 22:12:34,未知来源,2025-09-24 01:17:36,中性,0,该新闻仅提及紫金矿业出现在减持披露名单中，但未提供具体减持主体、数量、比例等关键信息。政策本身未直接提及公司或其主营业务，对公司的收入、成本或利润无直接影响。,-1,减持信息披露可能引发市场对公司短期流动性和股东信心的担忧，对市场情绪产生轻微负面影响。但该信息未改变行业基本面或竞争格局，对上下游产业链无实质影响。,0.7,立即,-1,减持具体细节不明，若为大股东或重要股东减持可能冲击股价|市场情绪可能因减持信息而转弱|信息源为未知来源，准确性有待验证,观望
278,【2025基金中报透视：医药、银行、电子成加仓重点 舒泰神基金持股比例增长居首】近日，公募基金2025年中报披露结束。从行业配置来看，今年上半年，医药生物、银行、电子等板块的基金持股市值显著增长，而电...,2025-09-02 14:36:36,未知来源,2025-09-24 01:14:54,中性偏正,2,新闻直接提及紫金矿业在基金持股市值增长方面排名领先，表明机构投资者对其关注度和配置意愿提升，可能带来增量资金流入,1,新闻显示有色金属行业未被重点加仓，但紫金矿业作为行业龙头获得资金青睐，可能提升其在行业内的相对竞争优势,0.7,立即,3,基金持仓变化具有短期波动性，可能随时调整|有色金属行业整体未获资金青睐，行业基本面支撑不足,关注
277,"【中金：升紫金目标价至30港元 中绩符预期上调盈测】中金研究报告指出，紫金矿业(02899.HK)中期业绩符该行预期，上半年实现营业收入1,677.11亿元人民币，按年增11.5%；实现归母净利润23...",2025-09-01 13:11:37,未知来源,2025-09-24 01:13:34,强烈正面,4,中金报告直接提及紫金矿业，上调目标价40.1%至30港元，并大幅提升今明两年净利润预测（分别+9%和+22%），显示对公司业绩增长的高度认可，将直接提振市场信心和股价表现,3,龙头券商上调行业龙头目标价并看好远期产量，可能带动整个有色金属板块估值提升，增强投资者对资源板块的信心，但对竞争格局影响有限,0.9,立即,8,大宗商品价格波动风险|宏观经济下行影响需求|汇率波动对港股目标价的影响,强烈关注
276,【港股午评：恒生指数涨1.77%，恒生科技指数涨1.77%】港股午间收盘，恒生指数涨1.77%，恒生科技指数涨1.77%。港股科技ETF（159751）涨1.67%，恒生港股通ETF（159318）涨...,2025-09-01 12:03:16,未知来源,2025-09-24 01:10:37,中性偏正,1,港股大盘上涨带动公司股价上涨5.86%，属于市场整体情绪推动的短期表现,1,市场整体风险偏好提升有利于有色金属板块表现，但属于系统性影响而非公司特有因素,0.5,立即,2,市场波动性较大|涨幅可能随时回调|与公司基本面关联度较低,观望
275,大华继显将紫金矿业目标价从24.00港元上调至29.70港元。...,2025-09-01 11:23:49,未知来源,2025-09-24 01:10:37,正面,2,知名机构上调目标价23.75%，显示对公司未来业绩和股价表现的乐观预期，可能吸引更多机构投资者关注,1,提升市场对公司基本面的信心，有助于改善投资者情绪和估值水平,0.6,立即,3,分析师观点可能存在偏差|市场情绪变化可能影响目标价实现|仅为单一机构观点,关注
274,【价格上行推高行业盈利 有色金属强势格局或仍延续】2025年上半年，有色金属商品价格整体上行，继续成为拉动行业盈利的重要因素。截至8月29日晚，有色板块上市公司已披露的2025年半年报中，超六成企业期...,2025-08-30 08:58:19,未知来源,2025-09-24 01:10:37,正面,3,有色金属价格整体上行将直接提升公司黄金、铜等主要产品的销售价格和利润率,2,行业景气度提升有利于整个有色金属板块估值修复，公司作为行业龙头将受益于行业整体向好趋势,0.7,立即,5,价格波动风险|宏观经济不确定性可能影响需求|美联储政策变化对金价影响,关注
273,【紫金矿业：安徽沙坪沟钼矿项目收购完成交割】紫金矿业公告，公司通过公开摘牌方式获得的安徽金沙钼业有限公司84%股权已完成工商变更登记，正式过户至公司名下。金沙钼业持有安徽省金寨县沙坪沟钼矿100%权益...,2025-08-29 18:31:10,未知来源,2025-09-24 01:10:37,强烈正面,4,直接收购全球罕见超大型钼矿项目，新增钼金属储量110万吨，设计年产能2.21万吨钼精矿，将显著增加公司资源储备和未来盈利能力,3,增强公司在有色金属领域的多元化布局，提升在钼金属市场的竞争地位，有利于优化产品结构,0.9,6个月以上,7,项目开发周期较长，短期难以贡献利润|钼金属价格波动风险|项目开发资本支出压力,强烈关注
272,紫金矿业集团周三发出警告称，地缘政治紧张局势正在引发关键矿产资源的争夺战。...,2025-08-27 22:20:28,未知来源,2025-09-24 01:09:06,中性偏负,-2,地缘政治紧张局势可能增加公司海外矿产资源获取成本和运营风险，但对现有业务收入利润无直接影响,-3,关键矿产资源争夺战可能推高上游资源采购成本；加剧国际矿业市场竞争；对全球有色金属行业带来不确定性,0.7,3-6个月,-5,地缘政治风险加剧|海外业务运营风险增加|矿产资源获取成本上升,谨慎
271,美股周三早盘，紫金矿业集团（香港交易所代码：02899 / 国际证券代码：ZIJMF，金融类）上涨1.25%。财报显示，受战略商品需求强劲推动，紫金矿业上半年净利润同比增长54%，达到233亿元人民币...,2025-08-27 22:18:29,未知来源,2025-09-24 01:09:06,中性偏正,1,美股早盘上涨1.25%反映市场对财报的积极反应，但对公司基本面无直接影响,1,国际市场价格表现可能提升投资者信心，但对产业链和竞争格局无实质影响,0.6,立即,2,美股市场波动性较大|短期股价变动不代表长期趋势,观望
270,【紫金矿业：2025年上半年净利润232.92亿元，同比增长54.41%】紫金矿业公告，2025年上半年营业收入1677.11亿元，同比增长11.50%。净利润232.92亿元，同比增长54.41%。...,2025-08-26 19:03:05,未知来源,2025-09-24 01:09:06,强烈正面,5,财报显示净利润232.92亿元，同比增长54.41%，直接反映公司盈利能力强劲增长；每10股派现2.2元现金红利直接提升股东回报,3,强劲业绩表现可能提升公司在行业内的竞争地位和市场份额；对行业整体有正面示范效应，显示有色金属行业景气度较高,0.95,立即,8,业绩高增长可能难以持续|金属价格周期性波动风险,强烈关注
269,【紫金矿业成立稀贵金属公司，注册资本50亿】天眼查工商信息显示，近日，福建紫金稀贵金属有限公司成立，法定代表人为江城，注册资本50亿人民币，经营范围为贵金属冶炼、以自有资金从事投资活动、非煤矿山矿产资...,2025-08-22 19:19:38,未知来源,2025-09-24 01:09:06,正面,3,公司直接投资50亿元成立稀贵金属子公司，直接扩大业务范围至贵金属冶炼和矿产资源开采，有望增加新的收入来源,2,向上游延伸产业链，增强资源控制力；可能加剧贵金属冶炼领域的竞争；对行业整体影响有限，主要是公司个体战略布局,0.8,6个月以上,5,新业务投资回报周期较长|贵金属价格波动风险|新业务运营管理风险,关注
268,【11只绩优行业龙头股今日盘中股价创历史新高】证券时报·数据宝以Wind行业龙头成分股为参考对象，梳理发现，已披露半年报业绩数据的股票中，按照半年报、业绩快报、预告净利润下限（无下限则取公告数值）计算...,2025-08-13 16:24:55,未知来源,2025-09-24 01:08:24,中性偏正,1,新闻直接提及紫金矿业股价创历史新高，显示市场对公司业绩和前景的认可，但未直接涉及具体政策或业务变动。,2,作为行业龙头股，其强势表现可能提振有色金属板块信心，吸引资金流入，并强化其龙头地位，但对上下游和竞争格局无直接影响。,0.7,立即,3,股价已处历史高位，存在回调风险|大宗商品价格波动可能影响未来业绩,关注
267,港股黄金股集体走低，其中，赤峰黄金跌超5%，山东黄金跌超4%，潼关黄金、招金矿业、中国黄金国际、中国白银集团均跌超3%，灵宝黄金、珠峰黄金、紫金矿业跟跌。...,2025-08-11 09:49:22,未知来源,2025-09-24 01:07:44,中性偏负,-2,新闻未直接提及紫金矿业或其主营业务，但显示公司股价跟随黄金板块整体下跌。这反映了市场对黄金类资产的短期抛售情绪，可能暂时影响公司股价表现，但对公司实际收入和利润无直接影响。,-3,黄金股集体走低表明行业面临系统性压力，可能源于美元走强、利率预期变化或国际金价下跌。这会影响整个有色金属行业的估值水平和投资者信心，紫金矿业作为行业龙头难以独善其身。同时可能影响公司融资环境和并购扩张能力。,0.7,立即,-5,黄金价格持续下跌风险|板块资金流出风险|市场情绪转弱风险,观望
266,【紫金矿业：加纳阿基姆金矿采矿租约获加纳议会追认】8月1日，紫金矿业发布公告，加纳议会已审议并追认，阿基姆金矿于2024年9月获加纳国土与自然资源部批准的东部、西部的采矿租约，有效期分别至2037年1...,2025-08-01 20:57:47,未知来源,2025-09-24 01:06:17,正面,3,政策直接确认了紫金矿业在加纳阿基姆金矿的采矿租约合法性，消除了此前可能存在的法律不确定性。该金矿的全部资源和生产设施均位于租约范围内，确保了公司未来12-13年（至2037年）的黄金开采权益，对维持和稳定公司的黄金产量及未来收入有直接的正面影响。,2,此举巩固了紫金矿业在西非重要产金区的战略布局，提升了其在国际矿业市场的资源储备和声誉。对上游设备供应商和服务商需求稳定，对下游黄金销售无直接影响。在竞争格局上，增强了公司与其他国际矿业巨头在非洲竞争的实力，但对行业整体影响有限。,0.9,立即,5,加纳政治环境稳定性风险|国际金价波动风险|汇率风险（加纳塞地）,关注
265,【紫金矿业：副总裁沈绍阳拟减持不超过25.03万股】紫金矿业(601899.SH)公告称，公司副总裁沈绍阳因筹集公司2025年员工持股计划认购资金需求，计划自公告披露之日起15个交易日后的3个月内，通...,2025-07-27 15:36:49,未知来源,2025-09-24 01:04:48,中性偏负,-1,公告直接提及公司高管减持计划。减持数量虽小（25.03万股，相对于公司总股本可忽略不计），但高管减持行为可能被市场解读为负面信号，短期内可能对股价造成轻微压力。减持目的是为员工持股计划筹集资金，并非看空公司，但对公司收入、成本、利润无直接影响。,-1,高管减持可能引发市场对管理层信心的担忧，间接影响投资者情绪。但对公司上下游产业链、竞争格局及有色金属行业整体无实质性影响。该事件属于公司内部治理和股权结构变动，不影响行业基本面。,0.9,1个月内,-2,市场可能过度解读减持信号，导致股价短期波动|高管减持若引发连锁反应，可能影响市场信心,观望
264,【紫金矿业出资10亿成立贸易公司 含电池销售业务】天眼查显示，近日，福建紫金矿业贸易有限公司成立，法定代表人为黄孝隆，注册资本10亿人民币，经营范围含金属矿石销售、新型金属功能材料销售、普通货物仓储服...,2025-07-21 09:56:29,未知来源,2025-09-24 01:01:35,中性偏正,2,紫金矿业出资10亿成立贸易公司，含电池销售业务，可能拓展新的收入来源，但短期内对主营业务收入和利润影响有限,3,进入电池销售领域，可能与新能源产业链形成协同效应，增强公司在有色金属深加工的布局；但新业务需要时间培育，竞争格局存在不确定性,0.6,6个月以上,4,新业务培育周期较长，短期难以贡献显著利润|电池销售市场竞争激烈，存在业务拓展风险,观望
