news_id,original_title,original_date,original_source,analysis_time,sentiment,direct_impact_score,direct_impact_desc,indirect_impact_score,indirect_impact_desc,certainty,time_to_effect,overall_score,risk_factors,action_suggestion
1,有色金属行业资金流出榜：赣锋锂业、天齐锂业等净流出资金居前,2025-09-22 18:06:19,未知来源,2025-09-23 11:07:26,中性,0,政策新闻未直接提及紫金矿业或其主营业务，仅显示该股当日主力资金净流入2984.55万元，对公司的收入、成本、利润无直接影响,-1,行业整体资金净流出14.35亿元，显示市场对有色金属板块情绪偏谨慎。紫金矿业虽有小幅资金流入，但行业资金流出可能影响整体估值水平。锂业公司资金大幅流出可能反映新能源金属板块承压，但对以黄金、铜为主业的紫金矿业影响有限,0.6,立即,-1,行业整体资金流出可能持续影响板块情绪|市场风险偏好变化可能影响有色金属板块估值,观望
2,紫金黄金国际市值或超1800亿港元，系港股年内第二大IPO,2025-09-22 17:50:56,未知来源,2025-09-23 11:07:55,强烈正面,4,政策直接提及紫金矿业分拆子公司紫金黄金国际在港股上市，将获得超过200亿港元融资，显著提升母公司资金实力；分拆上市后紫金黄金国际估值市盈率达23倍，高于紫金矿业A股15倍估值，有望推动母公司黄金资产价值重估，提升整体市值。,3,分拆上市增强紫金矿业资金实力，支持海外黄金资源并购，强化行业竞争力；'平台化'运营策略（如藏格矿业聚焦钾锂业务）可能优化资源配置，提升集团整体效率；对有色金属行业资本运作起到示范作用，但可能加剧头部企业竞争。,0.9,立即,8,港股市场波动可能影响紫金黄金国际上市后估值稳定性|黄金价格周期变化可能影响分拆资产长期盈利预期|海外并购整合存在执行风险,强烈关注
3,现货黄金再创新高，有色ETF基金(159880)涨超1%,2025-09-22 15:44:51,未知来源,2025-09-23 11:08:19,强烈正面,4,政策虽未直接提及紫金矿业，但公司作为国内最大黄金生产企业之一，黄金业务占营收比重约50%，金价创新高将直接提升公司黄金销售收入和利润水平,3,金价上涨带动整个有色金属板块走强，提升行业估值水平；公司作为行业龙头，在资源获取和市场份额方面将受益于行业景气度提升,0.8,立即,7,美联储政策不确定性可能影响金价持续性|宏观经济波动可能影响金属需求|公司海外运营面临地缘政治风险,强烈关注
4,港股有色金属板块拉升走强，招金矿业、灵宝黄金涨超5%,2025-09-22 09:42:15,未知来源,2025-09-23 11:09:02,中性偏正,1,新闻未直接提及紫金矿业或其主营业务，仅报道板块整体上涨且该股涨超1%。这反映了市场情绪改善，但对公司收入/成本/利润无直接实质性影响。,2,板块整体走强表明行业情绪乐观，可能源于金属价格上涨预期或需求改善。这有利于紫金矿业的销售环境和产品定价，但对上下游产业链和竞争格局无具体改变。,0.6,立即,3,消息来源未知，可靠性存疑|板块上涨可能受短期情绪驱动，缺乏基本面支撑|金属价格波动风险,关注
5,42股获杠杆资金净买入超亿元,2025-09-22 09:39:30,未知来源,2025-09-23 11:09:21,中性偏正,1,政策未直接提及紫金矿业，但公司获得1.46亿元融资净买入，显示杠杆资金短期看好，可能带来股价上涨动力,0,政策反映市场整体风险偏好变化，但对有色金属行业无特定影响，紫金矿业作为行业龙头可能间接受益于市场流动性改善,0.7,立即,1,融资买入具有短期性，资金可能快速撤离|大宗商品价格波动可能抵消资金面利好|全球宏观经济不确定性影响金属需求,关注
1,"招金矿业拟3000万美元等值港元认购紫金国际港股IPO基石股份

9月19日，招金矿业（01818.HK）公告，公司全资附属公司斯派柯国际有限公司于9月17日与紫金国际及摩根士丹利、中信证券、中信里昂...",2025-09-20 08:16:33,未知来源,2025-09-22 17:54:43,中性偏正,1,政策未直接提及紫金矿业(601899)本身，而是其全资子公司紫金国际的IPO。招金矿业作为关联方认购基石股份，强化了战略合作关系，但对紫金矿业的收入、成本、利润无直接财务影响。,2,通过子公司IPO增强资本实力，支持国际化扩张；深化与招金矿业的战略合作，可能带来协同效应；行业高景气下，龙头地位巩固，但对竞争格局无显著改变。,0.8,3-6个月,3,子公司IPO市场反应不及预期|黄金价格波动风险|关联交易监管审查,关注
2,"资源型企业赴港上市加速 港股迎年内第二大IPO

2025年以来，港股IPO市场持续火热，生物医药、科技、消费等行业的明星企业不断上市。同时，一些资源型企业的上市之路也在明显加快，从黄金、有色金属到能...",2025-09-20 01:57:42,未知来源,2025-09-22 17:54:51,中性偏正,2,政策直接提及紫金矿业分拆子公司紫金黄金国际赴港上市。此次IPO募资244.7亿港元，将用于矿山升级建设、海外金矿收购及勘探活动，有望提升公司黄金业务的资本实力和资源储备，但对A股母公司的短期财务影响中性。,1,分拆上市可能优化紫金矿业资产结构，聚焦核心铜业务；同时加剧黄金开采领域的竞争，但公司凭借低品位资源开发优势可能巩固行业地位；行业整体受益于融资渠道拓宽和国际化进程加速。,0.9,1个月内,3,港股市场波动可能影响发行价和募资效果|分拆后业务协同效应减弱|海外项目收购存在运营和政治风险,关注
1,"紫金矿业子公司紫金黄金国际拟香港联交所上市 发行价71.59港元/股

上证报中国证券网讯（记者王乔琪）紫金矿业9月19日早间发布公告，公司收到所属子公司紫金黄金国际有限公司（简称“紫金黄金国际”）通...",2025-09-19 10:32:23,未知来源,2025-09-22 16:35:55,中性偏正,2,子公司分拆上市将直接为紫金矿业带来资本增值收益，通过股权稀释获得一次性投资收益，增强母公司现金流和财务实力，但短期内对主营业务收入和利润无直接影响,3,提升紫金矿业在国际资本市场的品牌影响力，优化黄金业务板块的资本结构，可能增强其在有色金属行业的竞争地位，为后续并购扩张提供资金支持,0.9,立即,4,港股市场波动可能影响发行效果|黄金价格波动影响子公司估值|分拆后业务协同效应可能减弱,关注
2,"每股71.59港元 紫金矿业旗下紫金黄金国际启动港股公开发售，9月29日挂牌交易

9月19日，紫金矿业（601899/02899）发布公告，拟分拆所属子公司紫金黄金国际有限公司至香港联合交易所主板上...",2025-09-19 09:38:41,未知来源,2025-09-22 16:36:04,中性偏正,2,分拆子公司港股上市将直接为紫金矿业带来一次性融资收益，提升资本实力，但短期内可能摊薄母公司股东权益,3,通过分拆黄金业务独立上市，可提升黄金板块估值水平，增强品牌国际影响力，优化公司治理结构，有利于聚焦主业发展,0.9,立即,5,港股市场波动可能影响发行价格和融资效果|分拆后业务协同效应可能减弱|黄金价格波动风险,关注
3,"有色金属行业资金流出榜：北方稀土、紫金矿业等净流出资金居前

沪指9月18日下跌1.15%，申万所属行业中，今日上涨的有3个，涨幅居前的行业为电子、通信、社会服务，涨幅分别为0.93%、0.19%、0...",2025-09-18 17:23:20,未知来源,2025-09-22 16:36:16,中性偏负,-2,政策新闻直接提及紫金矿业为有色金属行业资金净流出居前的个股之一，单日净流出资金达10.38亿元，反映短期市场资金面承压，可能加剧股价波动。但新闻未改变公司基本面，对收入、成本、利润无直接影响。,-3,有色金属行业整体下跌3.56%，主力资金净流出127.48亿元，行业情绪低迷。资金大幅流出可能反映市场对有色金属需求或价格的担忧，间接影响公司估值和投资者信心。竞争格局未变，但行业资金面紧张可能压制板块表现。,0.9,立即,-5,行业资金大幅流出|市场情绪低迷|有色金属价格波动风险,观望
4,"藏格矿业：紫金矿业入主后，藏格矿业仍将战略重心聚焦于钾、锂上游资源的开发与运营

每经AI快讯，有投资者在投资者互动平台提问：我司曾参股重庆骏力（现已注销）扩展锂电中下游产业链，现在紫金已入主藏格，而...",2025-09-17 21:36:49,未知来源,2025-09-22 16:36:42,中性偏正,1,政策未直接提及紫金矿业或其主营业务，但确认了藏格矿业（紫金矿业已入主）将继续聚焦钾、锂上游资源开发，这有助于巩固紫金在锂资源端的布局，对长期资源储备和成本控制有轻微正面影响。,2,紫金矿业通过入主藏格矿业强化了上游锂资源控制，但藏格明确不参与中下游产业链，可能与紫金自身的锂电中下游战略形成协同互补，减少内部竞争，提升产业链效率；对行业而言，加剧了上游资源集中度，但对竞争格局影响有限。,0.7,6个月以上,3,藏格矿业不参与中下游可能限制紫金产业链整合的协同效应|锂资源开发周期长，短期对业绩贡献有限,关注
5,"有色金属行业资金流出榜：北方稀土、紫金矿业等净流出资金居前

沪指9月16日上涨0.04%，申万所属行业中，今日上涨的有21个，涨幅居前的行业为综合、机械设备，涨幅分别为3.62%、2.06%。跌幅居...",2025-09-16 17:06:59,未知来源,2025-09-22 16:37:03,中性偏负,-2,政策新闻未直接提及紫金矿业或其主营业务，但显示该股当日主力资金净流出13.04亿元，居行业第二，可能反映短期市场情绪转弱。资金流出本身不直接影响公司收入/成本/利润，但可能加剧股价波动。,-1,行业整体资金净流出103.35亿元且下跌0.99%，表明板块面临抛压，可能影响上下游产业链信心；竞争格局未变，但资金流出榜中紫金矿业与北方稀土等龙头均受波及，反映行业短期承压。,0.8,立即,-3,主力资金大幅流出或延续|行业整体表现疲软拖累个股|市场情绪转弱可能放大波动,观望
6,"紫金矿业黄金业务冲刺港股IPO：子公司递交聆讯资料，年内已豪掷百亿全球扫货

深圳商报·读创客户端记者穆砚 9月14日晚间，紫金矿业集团股份有限公司（以下简称“紫金矿业”或“公司”）发布关于分拆所属子...",2025-09-15 14:46:05,未知来源,2025-09-22 16:37:19,正面,3,政策直接提及紫金矿业分拆黄金业务赴港IPO，有助于提升黄金业务估值和融资能力；公司上半年净利润同比增长54.41%，黄金业务毛利占比38.6%，分拆可能进一步释放价值。,2,分拆上市可能增强公司在黄金行业的竞争力，通过融资支持全球并购（如加纳Akyem金矿、哈萨克斯坦Raygorodok金矿），提升资源储备；但对上下游产业链影响有限，行业整体或受益于龙头企业的资源整合。,0.7,3-6个月,5,分拆上市需联交所批准，存在不确定性|黄金价格波动可能影响业务盈利能力|境外资产占比47%，地缘政治风险,关注
7,"紫金矿业：紫金黄金国际已向香港联交所递交聆讯后资料集

紫金矿业9月15日公告，9月14日，公司收到所属子公司紫金黄金国际通知，其已于当日向香港联交所递交聆讯后资料集。（文章来源：界面新闻）...",2025-09-15 08:52:21,未知来源,2025-09-22 16:37:38,中性偏正,2,子公司紫金黄金国际赴港上市将直接提升紫金矿业的融资能力，可能为母公司带来资本增值和潜在的股权收益，但对主营业务收入和利润的直接影响有限,3,分拆上市有助于优化公司治理结构，提升黄金业务的品牌独立性和市场竞争力；可能促进行业资本运作活跃度，但对上下游产业链和整体行业格局影响有限,0.7,3-6个月,5,港股市场流动性风险|分拆后业务协同效应减弱|国际金属价格波动影响估值,关注
8,"紫金矿业：紫金黄金国际已向香港联交所递交聆讯后资料集

南方财经9月15日电，紫金矿业公告，9月14日，公司收到所属子公司紫金黄金国际通知，其已于当日向香港联交所递交聆讯后资料集。 （文章来源：南方财...",2025-09-15 08:50:16,未知来源,2025-09-22 16:37:56,正面,2,子公司紫金黄金国际向香港联交所递交聆讯后资料集，表明分拆上市进程推进，有望通过股权融资增强资本实力，为母公司紫金矿业带来潜在投资收益和现金流改善，但直接影响有限且存在不确定性。,3,分拆上市若成功，可提升紫金矿业品牌国际影响力，优化黄金业务管理效率，强化产业链协同；可能加剧行业资本竞争，但对行业整体融资渠道拓展有示范效应。,0.7,3-6个月,5,联交所审批结果不确定|市场波动可能影响发行估值|分拆后管理协同效果不及预期,关注
9,"紫金矿业阿根廷年产2万吨碳酸锂项目投产

新京报贝壳财经讯据紫金矿业官网消息，阿根廷当地时间9月12日，紫金矿业旗下锂业科思3Q锂盐湖年产2万吨碳酸锂项目投产仪式在卡塔马卡省菲安巴拉市举行，标志着紫金...",2025-09-14 16:40:36,未知来源,2025-09-22 16:38:11,强烈正面,4,项目直接投产将立即为公司新增年产2万吨碳酸锂产能，直接进入新能源产业链，预计将显著增加公司收入和利润，开辟新的增长曲线,3,增强公司在新能源材料领域的战略布局，提升国际化资源掌控能力；可能改变有色金属行业竞争格局，推动行业向新能源转型；对上游锂资源开发和下游新能源产业链产生积极影响,0.9,立即,8,阿根廷政治经济环境风险|碳酸锂价格波动风险|项目运营初期可能存在的技术磨合风险,强烈关注
10,"紫金矿业阿根廷年产2万吨碳酸锂项目投产

人民财讯9月14日电，据紫金矿业消息，阿根廷当地时间9月12日，紫金矿业旗下锂业科思3Q锂盐湖年产2万吨碳酸锂项目投产仪式在卡塔马卡省菲安巴拉市举行，标志着紫...",2025-09-14 13:48:03,未知来源,2025-09-22 16:38:34,强烈正面,4,政策直接提及紫金矿业，年产2万吨碳酸锂项目投产将直接为公司开辟新能源材料这一高增长赛道，预计将显著增加公司营收和利润，优化产品结构。,3,项目投产增强了公司在全球锂资源市场的地位，对上游锂资源供应和下游新能源产业链产生积极影响，可能改变有色金属行业的竞争格局，推动行业向绿色能源转型。,0.9,立即,8,碳酸锂价格波动风险|海外项目运营的政治和汇率风险|项目产能爬坡不及预期,强烈关注
11,"紫金矿业阿根廷年产2万吨碳酸锂项目投产

南方财经9月14日电，据紫金矿业官网消息，阿根廷当地时间9月12日，紫金矿业旗下锂业科思3Q锂盐湖年产2万吨碳酸锂项目投产仪式在卡塔马卡省菲安巴拉市举行。据了...",2025-09-14 13:35:16,未知来源,2025-09-22 16:38:54,强烈正面,4,项目直接投产将新增碳酸锂产能，为公司开辟新能源金属业务增长点，预计达产后年产能6-8万吨碳酸锂，显著提升收入规模和利润水平,3,延伸至锂电产业链上游，增强资源多元化布局；可能改变有色金属行业竞争格局，提升公司在新能源材料领域的地位；推动行业向绿色能源转型,0.8,3-6个月,7,锂价波动风险|海外项目运营风险|二期审批不确定性,强烈关注
12,"紫金矿业阿根廷年产2万吨碳酸锂项目投产

据紫金矿业消息，阿根廷当地时间9月12日，紫金矿业旗下锂业科思3Q锂盐湖年产2万吨碳酸锂项目投产仪式在卡塔马卡省菲安巴拉市举行。 据了解，当前，二期项目许可审...",2025-09-14 13:12:17,未知来源,2025-09-22 16:39:05,强烈正面,4,项目直接投产将新增碳酸锂产能，为公司开辟新的收入增长点，预计达产后年产能6-8万吨碳酸锂，显著提升公司营收和利润水平,3,项目投产增强公司在新能源金属领域的布局，完善有色金属产业链；可能改变锂行业竞争格局，提升公司在全球锂市场的份额；对有色金属行业向新能源转型具有示范效应,0.8,3-6个月,7,锂价波动风险|二期项目审批不确定性|海外运营政治风险|项目达产进度不及预期,强烈关注
13,"紫金矿业阿根廷年产2万吨碳酸锂项目投产

据紫金矿业消息，阿根廷当地时间9月12日，紫金矿业旗下锂业科思3Q锂盐湖年产2万吨碳酸锂项目投产仪式在卡塔马卡省菲安巴拉市举行。据了解，当前，二期项目许可审批...",2025-09-14 13:12:13,未知来源,2025-09-22 16:39:16,强烈正面,4,项目直接投产将新增碳酸锂产能，为公司开辟新的收入增长点，预计达产后年产能6-8万吨碳酸锂将显著贡献收入和利润,3,增强公司在新能源材料领域的布局，提升综合竞争力；可能对锂行业竞争格局产生影响，巩固公司作为多元化矿业巨头的地位,0.8,3-6个月,8,锂价波动风险|项目二期审批和建设进度不确定性|海外运营政治和汇率风险,强烈关注
41,"黄金牛市助推概念股狂飙 灵宝黄金年内涨幅超5倍

9月12日，现货黄金一度升至3674.27美元/盎司，再度创出新的历史纪录。 今年以来，随着国际黄金价格持续走高，市场看涨情绪高涨，港股市场的黄金概念...",2025-09-13 01:06:56,未知来源,2025-09-22 17:54:59,强烈正面,4,政策新闻直接提及紫金矿业，指出其年内股价涨幅达116.12%并刷新历史新高。公司作为黄金开采龙头企业，直接受益于金价上涨，上半年归母净利润同比增长54.4%。旗下紫金黄金国际分拆上市计划将进一步提升黄金资产价值重估和融资能力。,4,黄金牛市提振整个有色金属行业，尤其是黄金开采和零售板块。紫金矿业作为行业龙头，竞争优势进一步巩固。上游采矿权价值提升，下游黄金销售需求旺盛，产业链整体受益于金价上涨和市场需求增长。,0.9,立即,8,金价波动风险|美联储货币政策变化|国际经济不确定性,强烈关注
42,"龙净环保旗下公司获刚果（金）水电站项目开发权 总投资约3.99亿美元

龙净环保(600388)9月12日晚间公告，全资子公司紫金龙净清洁能源有限公司（下称“紫金龙净”）通过其全资子公司紫金龙净国际（...",2025-09-12 20:13:23,未知来源,2025-09-22 17:55:05,正面,2,政策虽未直接提及紫金矿业，但项目90%电量将优先供应紫金矿业在刚果（金）的矿企，预计电价约0.16美元/KWh，低于当地水电电价0.21美元/KWh，将直接降低其用电成本，提升利润率。,3,项目将保障紫金矿业在刚果（金）矿区的稳定电力供应，解决产能扩张的能源瓶颈，强化产业链协同优势，并可能提升其ESG评级，增强国际竞争力。,0.7,6个月以上,5,项目建设和并网进度可能延迟|刚果（金）政治和汇率风险|全球金属价格波动影响需求,关注
43,"龙净环保：子公司拟3.99亿美元投建刚果（金）凯兰庚水电站项目

上证报中国证券网讯（记者潘建樑）龙净环保晚间公告，公司全资子公司紫金龙净清洁能源有限公司通过其全资子公司紫金龙净国际（香港）控股有限公...",2025-09-12 19:22:26,未知来源,2025-09-22 17:55:14,正面,3,政策直接提及紫金矿业，项目发电将优先供给其在刚果（金）的权属企业，预计将有效降低其用电成本，提升能源供应稳定性，对利润有积极影响。,2,项目强化了紫金矿业的产业链协同优势，可能提升其在有色金属行业的成本竞争力；对行业整体影响较小，但体现了能源绿色转型的趋势。,0.7,6个月以上,5,项目投资金额较大，存在执行和资金风险|刚果（金）地缘政治和运营环境不确定性|水电站建设周期长，短期难以见效,关注
44,"龙净环保：拟在刚果（金）投建水电站项目 总额3.99亿美元

中证智能财讯龙净环保（600388）9月12日晚间公告，子公司紫金龙净清洁能源有限公司通过其全资子公司紫金龙净国际（香港）控股有限公司在刚...",2025-09-12 19:02:31,未知来源,2025-09-22 17:55:22,正面,3,政策直接提及紫金矿业在刚果（金）的权属企业，项目建成后90%电量将优先供应紫金矿业科卢韦齐矿区。预计供电电价0.16美元/KWh，低于当地水电电价0.21美元/KWh，可显著降低紫金矿业在刚果（金）的采矿业务电力成本，提升利润空间。,2,稳定低成本的电力供应有助于保障紫金矿业在刚果（金）矿区的产能扩张和运营效率，缓解当地电力短缺对生产的制约。项目由关联方龙净环保投资建设，可能强化产业链协同，但对行业竞争格局影响有限。,0.7,6个月以上,5,项目建设期3.5年，短期内无直接影响|刚果（金）政治及运营风险可能存在不确定性|电力供应实际执行效果需观察,关注
45,"龙净环保：全资子公司紫金龙净拟投资3.99亿美元建设刚果（金）凯兰庚水电站项目

每经AI快讯，9月12日，龙净环保(600388.SH)公告称，公司全资子公司紫金龙净通过其全资子公司紫金龙净国际（香...",2025-09-12 16:28:59,未知来源,2025-09-22 17:55:29,中性偏正,2,政策未直接提及紫金矿业，但项目建成后90%电量将优先供应紫金矿业在刚果（金）的权属企业，有望降低其电力成本，提升运营效率,3,稳定电力供应将保障紫金矿业在刚果（金）的矿产开采和冶炼业务，减少停电风险，提升产能利用率；对行业而言，体现了中资企业在海外资源开发的协同效应,0.7,6个月以上,5,项目建设和并网时间可能延迟|刚果（金）政治和运营环境风险|汇率波动影响投资成本,关注
46,"龙净环保：全资子公司拟投资3.99亿美元建设刚果（金）凯兰庚水电站项目

南方财经9月12日电，龙净环保(600388.SH)公告称，公司全资子公司紫金龙净通过其全资子公司紫金龙净国际（香港）控股有限...",2025-09-12 16:26:06,未知来源,2025-09-22 17:55:35,中性偏正,2,政策虽未直接提及紫金矿业，但项目建成后90%电量将优先供应紫金矿业在刚果（金）的权属企业，有望降低其电力成本，提升利润空间。,3,稳定电力供应有助于保障紫金矿业在刚果（金）的矿产运营，减少能源中断风险，增强产业链稳定性，但对行业竞争格局影响有限。,0.7,6个月以上,4,项目建设和并网时间可能延迟|刚果（金）政治和运营风险|电力定价机制未明确,关注
14,"紫金矿业：关于2025年员工持股计划非交易过户完成的公告

证券日报网讯 9月11日晚间，紫金矿业发布公告称，2025年9月11日，公司收到中国证券登记结算有限责任公司出具的《过户登记确认书》，公司回...",2025-09-11 20:34:28,未知来源,2025-09-22 16:39:26,中性偏正,1,政策直接提及该公司，员工持股计划完成过户。此举通过将公司回购股份以10.61元/股的价格（低于当前市价，体现激励性）非交易过户给员工，不直接影响公司当期收入或成本，但有助于绑定核心员工与公司利益，可能提升员工积极性和经营效率，长期对利润有潜在正向影响。,1,对上下游产业链无直接影响。在竞争格局上，通过增强团队稳定性，可能提升公司运营效率和竞争力，但对行业整体影响微弱，仅为个体公司治理行为。,0.9,6个月以上,2,员工持股计划激励效果不及预期|有色金属行业周期性波动可能掩盖长期激励效果|过户股份占比仅0.24%，影响相对有限,关注
15,"紫金矿业2025员工持股计划6432万股过户完成

紫金矿业（601899/02899）发布公告，关于2025年员工持股计划非交易过户完成的情况。公司于2025年6月26日召开股东会，审议通过员工持股...",2025-09-11 19:09:26,未知来源,2025-09-22 16:39:37,中性偏正,1,政策直接提及紫金矿业，员工持股计划过户完成。此举将核心员工利益与公司长期发展绑定，有助于提升员工积极性和忠诚度，可能间接降低人力成本、提升运营效率，但对公司当期收入、成本和利润无直接影响。,2,通过激励核心员工，有望提升公司整体运营效率和竞争力，间接巩固其在有色金属行业的领先地位。对上下游产业链和行业整体竞争格局无直接影响，但可能通过提升单个公司绩效对行业产生微弱正面示范效应。,0.9,6个月以上,3,锁定期长达24个月，短期激励效果有限|最终收益取决于未来公司业绩和个人考核，存在不确定性|计划规模占总股本比例较小(0.24%)，影响范围有限,关注
