news_id,original_title,original_date,original_source,analysis_time,sentiment,direct_impact_score,direct_impact_desc,indirect_impact_score,indirect_impact_desc,certainty,time_to_effect,overall_score,risk_factors,action_suggestion
77,【短期波动不改中长期向上趋势，代表核心优质资产的A50ETF华宝（159596）自上市以来持续受资金追捧】12月4日，沪指早间窄幅震荡，A50ETF华宝（159596）微跌0.18%，成交额6798万...,2024-12-04 11:53:49,未知来源,2025-09-23 23:05:02,中性偏正,1,政策新闻未直接提及紫金矿业，但提到A50ETF华宝重仓股中紫金矿业跟涨，显示其作为核心优质资产受到资金关注，可能带来短期资金流入,2,政策提及若未来政策加力出台、增量资金超预期流入，将推动市场预期改善，有利于有色金属行业整体估值提升；作为A50成分股，紫金矿业可能受益于ETF资金配置需求,0.6,1个月内,3,市场短期波动风险|政策落地不确定性|中美关系变化影响|大宗商品价格波动,关注
76,【紫金矿业：完成收购La Arena项目100%权益】 紫金矿业公告，公司通过全资子公司金誊矿业完成对泛美白银旗下秘鲁La Arena金矿及二期项目100%权益的收购交割。La Arena金矿目前在产...,2024-12-03 18:03:51,未知来源,2025-09-23 23:01:33,强烈正面,4,完成收购秘鲁La Arena项目100%权益，直接增加公司在产金矿资产，年产金约3吨，二期项目达产后预计年产铜10万吨、金3.8吨，显著提升产能和资源储备,3,海外优质资产收购增强公司全球化布局，提升在国际有色金属市场的竞争力，巩固行业地位,0.9,3-6个月,7,海外项目运营风险|金属价格波动影响项目收益|二期项目建设进度不确定性,强烈关注
75,【资金共振推动跨年行情，关注新质生产力及两重两新，可借道沪深300ETF南方（159925）一键布局】12月2日，沪深300ETF南方（159925）收盘涨0.69%，成交额8063.03万元。成份股...,2024-12-02 16:43:54,未知来源,2025-09-23 23:01:33,中性偏负,-1,新闻提到紫金矿业在沪深300ETF成份股中领跌，反映当日股价表现不佳，但未直接提及公司基本面变化,-1,作为沪深300成份股，ETF资金流动可能影响短期股价，但整体市场跨年行情预期对大盘股有利,0.6,立即,-2,短期市场情绪波动|ETF资金流动影响,观望
74,天风证券恢复跟踪紫金矿业A股，评级买进。...,2024-12-01 21:25:32,未知来源,2025-09-23 23:01:33,正面,2,天风证券恢复跟踪并给予买进评级，重复的正面信号强化了机构对公司看好的态度,1,重复的正面评级可能进一步增强市场对公司信心，提升关注度,0.8,立即,3,信息重复可能边际效应递减|依赖单一机构观点风险,关注
73,天风证券恢复跟踪紫金矿业A股，评级买进。...,2024-12-01 21:25:29,未知来源,2025-09-23 23:01:33,正面,2,天风证券恢复跟踪并给予买进评级，表明专业机构对公司前景看好，可能提升市场信心和投资者关注度,1,券商正面评级可能吸引更多机构投资者关注，改善市场流动性,0.8,立即,3,评级机构观点可能存在偏差|市场整体情绪影响评级效果,关注
72,【国盛证券：短期阶段性供需宽松制约铝价，国内供给刚性凸显铝价向上弹性】国盛证券研报称，后市看，需求预计较为冷清，供应预计保持高位，成本支撑虽在但支撑力度不足，短期看铝价震荡偏弱。建议关注：洛阳钼业、明...,2024-12-01 12:51:16,未知来源,2025-09-23 23:00:11,中性偏负,-2,虽然研报提及紫金矿业，但铝价短期震荡偏弱的预期对公司铝业务收入和利润可能产生负面影响,-3,铝行业阶段性供需宽松，需求冷清而供应保持高位，成本支撑不足，行业整体面临价格压力,0.6,1-3个月,-5,铝价下跌幅度可能超预期|需求复苏不及预期,谨慎
71,【国盛证券：短期阶段性供需宽松制约铝价，国内供给刚性凸显铝价向上弹性】国盛证券研报称，后市看，需求预计较为冷清，供应预计保持高位，成本支撑虽在但支撑力度不足，短期看铝价震荡偏弱。建议关注：洛阳钼业、明...,2024-12-01 12:51:13,未知来源,2025-09-23 23:00:11,中性偏负,-2,虽然研报提及紫金矿业，但铝价短期震荡偏弱的预期对公司铝业务收入和利润可能产生负面影响,-3,铝行业阶段性供需宽松，需求冷清而供应保持高位，成本支撑不足，行业整体面临价格压力,0.6,1-3个月,-5,铝价下跌幅度可能超预期|需求复苏不及预期,谨慎
70,【国盛证券：降息预期偏慢金价承压 未来持续看好黄金作为抗通胀品种以及美元资产替代角色的向上弹性】国盛证券研报称，核心通胀韧性叠加就业市场回温，降息预期偏慢金价周内承压。周内美国10 月核心 PCE 物...,2024-12-01 12:31:28,未知来源,2025-09-23 23:00:11,正面,3,研报直接提及紫金矿业作为黄金投资标的，黄金价格上涨将直接提升公司黄金业务收入和利润,4,黄金作为抗通胀品种和美元资产替代角色的向上弹性被看好，地缘政治风险提升避险需求，利好黄金开采企业,0.7,1-3个月,7,美联储降息预期变化可能影响金价走势|地缘政治局势变化存在不确定性,关注
69,【紫金矿业今日大宗交易成交418.27万股，成交额6558.46万元】紫金矿业11月27日大宗交易成交418.27万股，成交额6558.46万元，占当日总成交额的3.69%，成交价15.68元，较市场...,2024-11-27 20:45:26,未知来源,2025-09-23 23:00:11,中性,0,大宗交易成交价与市场收盘价持平，未出现折价或溢价，表明交易公允，对公司基本面无直接影响,-1,大宗交易可能引发市场对股东减持的担忧，短期内可能对股价形成轻微压力,0.8,立即,-1,可能存在未披露的大股东减持|市场情绪可能受到大宗交易影响,观望
67,【紫金矿业在福建成立黄金珠宝公司】天眼查App显示，近日，紫金矿业集团黄金珠宝（龙岩）有限公司成立，法定代表人为赖开辉，注册资本500万人民币，经营范围含珠宝首饰零售、金银制品销售、有色金属合金销售、...,2024-11-22 15:14:28,未知来源,2025-09-23 22:54:38,中性偏正,1,政策直接提及紫金矿业成立下游黄金珠宝销售公司，有助于公司延伸产业链，直接增加高附加值的零售业务收入，但对年收入数千亿的主营业务影响微小（注册资本仅500万）。,2,通过向下游珠宝零售延伸，公司可提升品牌价值、增强终端渠道控制力，并可能提高黄金产品的利润率。对现有竞争格局影响有限，但为行业纵向整合提供示范。,0.8,3-6个月,3,新业务初期投入与回报不确定|珠宝零售市场竞争激烈|与主业协同效果需观察,关注
66,【高盛称2025年沪深300或涨13%，A股公司回购总量有望翻倍】11月21日，沪深300ETF南方（159925）收盘涨0.23%，成交额6729.45万元。成份股涨跌互现，上涨方面，紫金矿业领涨，...,2024-11-21 15:50:32,未知来源,2025-09-23 22:53:08,中性偏正,0,政策新闻未直接提及紫金矿业或其主营业务，仅提及该公司在当日沪深300成份股中领涨。该新闻为高盛对A股市场的整体预测，未包含直接影响公司收入、成本或利润的具体政策或措施。,2,高盛对A股市场的乐观预期（沪深300指数2025年或涨13%）及资金面改善（政策推动资本流动转变、公司回购总量有望翻倍）可能间接利好紫金矿业。作为沪深300指数成份股，市场整体情绪提升和增量资金流入可能推高其估值。有色金属行业作为周期性行业，受益于宏观经济预期改善和消费稳定政策，但新闻未具体涉及上下游产业链或竞争格局变化。,0.6,6个月以上,2,预测基于高盛观点，非实际政策落地，存在不确定性|宏观经济焦点（如消费、房地产市场稳定）的实现进度可能影响效果|有色金属价格波动及全球需求变化可能抵消正面影响,关注
65,【高盛称2025年沪深300或涨13%，A股公司回购总量有望翻倍】11月21日，沪深300ETF南方（159925）收盘涨0.23%，成交额6729.45万元。成份股涨跌互现，上涨方面，紫金矿业领涨，...,2024-11-21 15:50:28,未知来源,2025-09-23 22:52:13,中性偏正,0,政策新闻未直接提及紫金矿业或其主营业务，也未针对有色金属行业发布具体政策。新闻中仅提到紫金矿业在当日交易中领涨，但这是市场表现而非政策直接影响。,2,高盛对A股市场的乐观预期和资金面改善的预测可能提升市场整体风险偏好，有利于大盘蓝筹股估值修复。沪深300指数上涨预期可能带动成分股紫金矿业的资金流入，回购总量翻倍预期显示上市公司对自身价值的认可，间接提振市场信心。,0.6,1-3个月,2,宏观经济政策实施效果存在不确定性|房地产市场稳定和消费复苏仍需时间|全球金属价格波动可能影响公司业绩,关注
64,【政策组合拳提振国内经济，龙头股或将优先受益，A50ETF华宝（159596）成交额超1.2亿元】11月21日，市场全天窄幅震荡，A50ETF华宝（159596）跌0.09%，成交额1.28亿元。上涨...,2024-11-21 15:30:34,未知来源,2025-09-23 22:49:20,正面,3,新闻明确提及紫金矿业领涨，显示股价强势表现，且作为龙头股可能优先受益政策,4,政策组合拳提振经济，逆周期政策强化有利于工业金属需求回升，龙头公司基本面优势有望强化,0.7,3-6个月,7,政策效果需要时间验证|经济复苏进度存在不确定性,关注
63,【ETF或将逐渐掌握A股定价权，A50ETF华宝（159596）昨日“吸金”1682万】11月21日，市场早盘窄幅震荡，三大指数小幅下跌，A50ETF华宝（159596）跌0.45%，成交额5010万...,2024-11-21 12:03:26,未知来源,2025-09-23 22:49:20,中性偏正,2,新闻提及紫金矿业在A50ETF重仓股中跟涨，显示当日股价表现优于ETF整体,3,ETF规模增长和定价权提升有利于大盘蓝筹股，作为行业龙头的紫金矿业可能获得更多被动资金配置,0.8,1-3个月,5,ETF资金流向变化较快|被动投资增长趋势存在不确定性,关注
62,【外资机构发声看好A股市场，A50ETF华宝（159596）单日成交额近2亿元】11月20日，沪指低开高走收涨0.66%，A50ETF华宝（159596）涨0.27%，成交额1.8亿元。十大重仓股涨跌...,2024-11-20 16:03:24,未知来源,2025-09-23 22:49:20,中性偏负,-2,新闻再次提及紫金矿业在A50ETF重仓股中领跌，显示连续弱势表现,1,高盛对A股'高配'建议和政策支持可能提升市场整体风险偏好，间接利好有色金属板块,0.6,立即,-1,个股连续弱势|宏观政策传导至个股存在时滞,观望
61,【外资机构发声看好A股市场，A50ETF华宝（159596）单日成交额近2亿元】11月20日，沪指低开高走收涨0.66%，A50ETF华宝（159596）涨0.27%，成交额1.8亿元。十大重仓股涨跌...,2024-11-20 16:03:17,未知来源,2025-09-23 22:49:20,中性偏负,-2,新闻直接提及紫金矿业在A50ETF十大重仓股中领跌，显示当日股价表现弱于市场,1,外资机构看好A股市场和宏观政策转向可能带来整体市场情绪改善，有利于有色金属板块,0.7,立即,-1,个股表现弱于市场指数|外资机构观点对个股影响有限,观望
60,【“坐看云起”时刻已至，机构关注三条主线，可借道沪深300ETF南方（159925）一键把握】11月20日，沪深300ETF南方（159925）收盘涨0.15%，成交额7406.80万元。成份股涨跌互...,2024-11-20 15:26:08,未知来源,2025-09-23 22:48:05,中性偏负,-1,新闻直接提及紫金矿业作为沪深300ETF南方的成份股领跌，显示当日股价表现不佳,1,机构关注顺周期板块，紫金矿业作为有色金属龙头可能受益于周期风格表现；同时经济复苏预期利好大宗商品需求,0.5,3-6个月,0,成长风格占优压制周期股|政策效果不及预期,观望
59,【偏蓝筹风格指数有望获得正面支撑，A50ETF华宝（159596）午盘涨0.36%，恒瑞医药涨超6%】11月20日，市场早间震荡反弹，三大股指小幅上涨，A50ETF华宝（159596）涨0.36%，成...,2024-11-20 11:59:04,未知来源,2025-09-23 22:48:05,中性偏负,-1,新闻直接提及紫金矿业作为A50ETF华宝的重仓股领跌，显示当日股价表现不佳，可能面临短期抛压,1,偏蓝筹风格指数有望获得正面支撑，紫金矿业作为大盘蓝筹股可能在中长期受益于风格切换,0.6,1-3个月,0,中小盘风格持续占优|四季度业绩不及预期,观望
58,【备受青睐！A50ETF华宝（159596）单日成交额超1.5亿元】11月19日，指数午后探底回升，A50ETF华宝（159596）涨0.45%，成交额1.5亿元。十大重仓股涨跌互现。上涨方面，紫金矿...,2024-11-19 16:18:59,未知来源,2025-09-23 22:48:05,中性偏正,1,新闻直接提及紫金矿业作为A50ETF华宝的重仓股领涨，显示其在ETF中表现突出，可能带来短期资金流入和关注度提升,2,逆周期政策强化和经济预期好转利好龙头股，紫金矿业作为有色金属行业龙头可能受益于整体经济复苏带来的需求提升,0.7,立即,3,ETF资金流向变化快速|宏观经济复苏不及预期,关注
57,【备受青睐！A50ETF华宝（159596）单日成交额超1.5亿元】11月19日，指数午后探底回升，A50ETF华宝（159596）涨0.45%，成交额1.5亿元。十大重仓股涨跌互现。上涨方面，紫金矿...,2024-11-19 16:18:57,未知来源,2025-09-23 22:48:05,中性偏正,1,新闻直接提及紫金矿业作为A50ETF华宝的重仓股领涨，显示其在ETF中表现突出，可能带来短期资金流入和关注度提升,2,逆周期政策强化和经济预期好转利好龙头股，紫金矿业作为有色金属行业龙头可能受益于整体经济复苏带来的需求提升,0.7,立即,3,ETF资金流向变化快速|宏观经济复苏不及预期,关注
56,【市值管理铺就慢牛之路，沪深300ETF南方（159925）投资价值备受关注】11月19日，沪深300ETF南方（159925）收盘涨0.61%，成交额1.12亿元。成份股涨跌互现，上涨方面，紫金矿业...,2024-11-19 15:28:55,未知来源,2025-09-23 22:46:41,正面,3,新闻内容与新闻3相同，市值管理政策直接利好紫金矿业这类沪深300成份股，有助于提升公司估值水平和市场关注度,3,重复强调市值管理政策对大盘蓝筹股的积极影响，紫金矿业作为有色金属行业龙头将持续受益,0.8,1-3个月,6,政策执行效果不确定性|市场情绪波动,强烈关注
55,【市值管理铺就慢牛之路，沪深300ETF南方（159925）投资价值备受关注】11月19日，沪深300ETF南方（159925）收盘涨0.61%，成交额1.12亿元。成份股涨跌互现，上涨方面，紫金矿业...,2024-11-19 15:28:52,未知来源,2025-09-23 22:46:41,正面,3,证监会发布市值管理指引，明确对主要指数成份股进行指引，紫金矿业作为沪深300成份股和领涨股，将直接受益于政策引导的价值投资,3,政策引导长期价值投资，有利于提升大盘蓝筹股估值，紫金矿业作为行业龙头有望获得更多机构资金配置,0.8,1-3个月,6,政策执行效果不确定性|市场情绪波动,强烈关注
54,【大盘核心风格有望回归，把握A50ETF华宝（159596）低位配置机遇】11月18日，A股三大指数集体下跌，A50ETF华宝（159596）跌0.45%，成交额2.23亿元。十大重仓股涨跌互现。上涨...,2024-11-18 16:09:50,未知来源,2025-09-23 22:46:41,中性偏正,1,新闻内容与新闻1完全相同，紫金矿业作为A50ETF重仓股当日表现相对较好，但无直接政策影响,2,重复强调大盘风格回归预期，继续利好紫金矿业这类大盘蓝筹股的估值修复,0.6,1-3个月,3,市场风格切换不确定性|宏观经济环境影响,关注
53,【大盘核心风格有望回归，把握A50ETF华宝（159596）低位配置机遇】11月18日，A股三大指数集体下跌，A50ETF华宝（159596）跌0.45%，成交额2.23亿元。十大重仓股涨跌互现。上涨...,2024-11-18 16:09:47,未知来源,2025-09-23 22:46:41,中性偏正,1,新闻未直接提及紫金矿业或其主营业务，但提到紫金矿业作为A50ETF重仓股之一当日跟涨，表明其作为大盘蓝筹股受到市场关注,2,大盘风格回归预期有利于紫金矿业这类大型蓝筹股获得更多资金关注，可能提升估值水平,0.6,1-3个月,3,市场风格切换不确定性|宏观经济环境影响,关注
52,【超260只基金复权单位净值创新高】虽然本周基金整体表现不佳，但在指数冲高的过程中，部分基金复权单位净值仍创出历史新高。据数据宝统计，本周共有超260只基金（不含年内新成立的基金）复权单位净值创出历史...,2024-11-17 23:23:32,未知来源,2025-09-23 22:45:23,中性偏正,2,与新闻3内容完全重复，华商甄选回报A基金将紫金矿业列为前十大重仓股，可能带来机构资金关注,1,基金净值创新高显示投资管理能力，但重复新闻未提供额外信息，影响与新闻3相同,0.7,1个月内,3,信息重复，无新增价值|基金投资策略可能调整,观望
51,【超260只基金复权单位净值创新高】虽然本周基金整体表现不佳，但在指数冲高的过程中，部分基金复权单位净值仍创出历史新高。据数据宝统计，本周共有超260只基金（不含年内新成立的基金）复权单位净值创出历史...,2024-11-17 23:23:27,未知来源,2025-09-23 22:45:23,中性偏正,2,华商甄选回报A基金将紫金矿业列为前十大重仓股，且基金净值创新高，可能带来增量资金流入,1,基金业绩表现良好可能吸引更多投资者关注重仓股，但新闻主要聚焦科技芯片基金，对有色金属行业整体影响有限,0.7,1个月内,3,基金重仓比例未明确|市场情绪变化可能影响资金流向,观望
50,【紫金矿业：回购注销2020年A股限制性股票激励计划部份激励对象A股限制性股票】紫金矿业(02899)发布公告，根据公司《2020年限制性股票激励计划(草案修订稿)》的规定，公司A股限制性股票激励对象...,2024-11-17 19:44:31,未知来源,2025-09-23 22:45:23,中性偏正,1,回购注销34.56万股限制性股票，占总股本比例极小（约0.0015%），对公司财务影响微乎其微,2,体现公司治理规范性，激励计划执行严格，有利于维护股东权益和激励有效性,1.0,立即,3,回购数量过少，实质性影响有限|仅涉及10名离职员工，范围较小,观望
49,11月12日，贝莱德在紫金矿业H股的多头头寸从6.49%增加到7.11%。...,2024-11-15 17:10:55,未知来源,2025-09-23 22:45:23,正面,3,贝莱德增持紫金矿业H股股权至7.11%，显示国际顶级投资机构对公司前景的看好，可能带来增量资金和股价支撑,2,国际知名机构的增持行为可能引发其他投资者关注和跟风，提升市场对公司信心，改善投资者结构,0.9,立即,5,增持比例相对有限|H股流动性可能影响实际效果,关注
48,【机构称当前A股处于历史上较为活跃状态，沪深300ETF南方（159925）配置价值备受关注】11月15日，沪深300ETF南方（159925）收盘跌1.58%，成交额1.23亿元。成份股涨跌互现，上...,2024-11-15 16:48:30,未知来源,2025-09-23 22:44:11,正面,3,新闻直接提到紫金矿业在沪深300ETF成份股中领涨，显示其受到市场资金青睐。机构观点认为A股处于活跃状态，资金面有较好承接力，支持市场震荡走高，直接有利于公司股价表现。,2,市场活跃状态和资金流入有助于提升整个有色金属行业的估值水平，紫金矿业作为龙头公司可能获得更多机构资金配置，强化行业领先地位。,0.7,立即,5,市场情绪变化风险|增量资金持续性不确定,强烈关注
47,【剑指核“新”资产！A50ETF华宝（159596）成交额超1.4亿元】11月15日，三大指数集体调整，A50ETF华宝（159596）跌1.75%，成交额1.46亿元。十大重仓股涨跌互现。上涨方面，...,2024-11-15 16:34:16,未知来源,2025-09-23 22:44:11,正面,3,新闻直接提及紫金矿业作为A50ETF华宝十大重仓股中的领涨股，显示其在核心资产中表现突出。政策要求重点指数成份股公司制定市值管理制度，有助于提升公司估值和投资回报水平。,2,政策支持核心资产长期向好，紫金矿业作为行业龙头可能受益于资金流入和估值提升。对行业整体有正面带动作用，增强有色金属板块吸引力。,0.8,1-3个月,5,市场整体波动风险|政策执行效果不确定性,关注
46,【紫金矿业发布关于外媒就哥伦比亚武里蒂卡金矿报道的情况说明】11月14日晚，紫金矿业公告，公司于今日关注到国内部分媒体和自媒体平台转译外媒有关公司控股的Continental Gold Inc.（下称...,2024-11-14 19:46:32,未知来源,2025-09-23 22:44:11,中性偏负,-2,新闻内容与新闻1完全相同，均涉及哥伦比亚武里蒂卡金矿的非法采矿问题，直接提及紫金矿业控股子公司资源被盗采，造成实际损失，尽管产量保持增长。,-1,重复的负面报道可能加剧市场对公司在海外运营风险的关注，对投资者信心产生叠加影响，但对行业竞争格局和产业链影响有限。,0.7,立即,-3,重复负面消息放大市场担忧|海外运营安全风险|资源损失核实不确定性,关注
45,【紫金矿业发布关于外媒就哥伦比亚武里蒂卡金矿报道的情况说明】11月14日晚，紫金矿业公告，公司于今日关注到国内部分媒体和自媒体平台转译外媒有关公司控股的Continental Gold Inc.（下称...,2024-11-14 19:40:56,未知来源,2025-09-23 22:44:11,中性偏负,-2,新闻直接提及紫金矿业控股的哥伦比亚武里蒂卡金矿存在非法采矿问题，导致高品位矿体被盗采，造成资源损失。虽然产量持续上升且经营业绩良好，但非法采矿直接增加了安全成本和资源损失风险。,-1,非法采矿问题可能影响公司在国际市场的声誉，增加投资者对海外运营风险的担忧。对行业整体影响较小，但可能引发对类似海外矿业项目的安全评估。,0.7,立即,-3,非法采矿持续导致资源损失|哥伦比亚安全环境不稳定|仲裁结果不确定性,关注
43,【3.2吨黄金遭掠夺？紫金矿业回应】11月14日，有消息称，紫金矿业位于哥伦比亚的金矿遭贩毒集团掠夺，损失约3.2吨黄金，总价值约2亿美元。对此，紫金矿业回应记者称，公司位于哥伦比亚的金矿确实长期遭到...,2024-11-14 16:01:37,未知来源,2025-09-23 22:40:16,中性偏负,-1,事件直接提及公司哥伦比亚金矿遭掠夺，但公司回应称损失是多年累积且金额不确定，经营未受影响，故直接影响有限,-2,事件可能引发市场对公司在高风险地区运营安全的担忧，影响投资者信心，但对上下游产业链和行业竞争格局无显著影响,0.6,立即,-3,哥伦比亚运营环境风险|潜在资产损失不确定性|市场情绪波动,观望
42,【被掠夺3吨黄金？紫金矿业：武里蒂卡金矿安全形势显著恶化，谴责非法采矿行为】近日，有媒体报道称，紫金矿业在哥伦比亚的一金矿遭到掠夺，损失超过3吨黄金。11月14日下午，记者联系了紫金矿业核实该消息。紫...,2024-11-14 15:16:51,未知来源,2025-09-23 22:39:40,负面,-3,政策虽未直接提及公司，但事件直接涉及公司海外核心资产。武里蒂卡金矿遭非法采矿掠夺，直接导致黄金实物资产损失（3吨黄金约合人民币15-18亿元），并因安全形势恶化导致生产运营受到干扰，增加额外的安保成本和潜在生产中断风险，对当期成本和利润产生直接负面影响。,-2,事件暴露了公司在哥伦比亚运营的政治和安全风险，可能影响投资者对公司海外资产安全性和管理能力的信心。对上游供应链影响有限，但可能削弱公司在国际资源并购市场的声誉。对行业整体影响较小，主要为个案风险，但可能引发市场对同类海外矿业企业地缘政治风险的重新评估。,0.8,立即,-5,哥伦比亚地缘政治风险升级|矿区生产安全持续受威胁|潜在资产减值损失|海外运营管理能力受质疑,谨慎
41,【被掠夺3吨黄金？紫金矿业：武里蒂卡金矿安全形势显著恶化，谴责非法采矿行为】近日，有媒体报道称，紫金矿业在哥伦比亚的一金矿遭到掠夺，损失超过3吨黄金。11月14日下午，记者联系了紫金矿业核实该消息。紫...,2024-11-14 15:16:23,未知来源,2025-09-23 22:38:11,负面,-3,事件直接涉及紫金矿业海外核心资产，3吨黄金损失虽未获公司直接确认，但安全形势恶化已对生产经营造成影响。潜在损失约15亿元（按500元/克金价估算），占年产量比重较高，同时可能增加安全成本和产能不确定性。,-2,事件可能削弱市场对矿企海外资产安全性的信任，推高行业整体风险溢价；竞争对手或趁机抢占份额，但紫金矿业凭借产能韧性（2023年仍产金8.3吨）暂未显著改变行业竞争格局。,0.7,立即,-5,哥伦比亚政局不稳导致安全持续恶化|非法采矿活动蔓延至其他矿区|潜在产量下滑及成本超预期上升,谨慎
